video_id,video_timestamp,video_duration,video_locationcreated,suggested_words,video_diggcount,video_sharecount,video_commentcount,video_playcount,video_description,video_is_ad,video_stickers,author_username,author_name,author_followercount,author_followingcount,author_heartcount,author_videocount,author_diggcount,author_verified
7182449354572107051,2022-12-29T01:12:06,0,US,,491,13,3,8690,this is just a compilation of the many travel vids i watched but i haven’t gone yet so take it with a grain of salt!! i forgot to add this in but you should also bring a film camera or a y2k digital camera to capture more mems!! #traveltiktok #spain #studyabroad #abroad #abroadlife #packinglist #travel ,False,,myatheestallion,mya,,,,,,False
7293864343811181857,2023-10-25T07:59:17,49,DE,,524200,22000,2024,3800000,@WAKEUPTOREALITY ile #düet #motivation #speech #viral #fyp,False,,tiktokreelsx1,tiktokreelsx,,,,,,False
7307235128617618690,2023-11-30T07:44:23,6,JP,,2900000,131600,15200,13200000,spidergyatt,False,,hakaosan,Hakao,,,,,,False
7299573961564638507,2023-11-09T16:15:21,14,US,"leopard gecko, leopard, Gecko, Gecko Reptiles, Leopard Gecko Pet, Giant Gecko, Leopard Gecko Scream, Leopard Gecko Tank Setup, Gecko Defense Tail, gecko drops its tail",28600,93,293,189900,Im sick so enjoy some of these closeups of my son #sunny #leo #leopardgecko ,False,,_sugarlo_,SugarLo 🍉,,,,,,False
7299641185168067886,2023-11-09T20:36:12,9,US,,38400,1094,679,362600,Replying to @Colton okay! #verynice ,False,,_sugarlo_,SugarLo 🍉,,,,,,False
7307358600912227630,2023-11-30T15:43:50,137,US,"lethal company, coil head lethal company, lethal company funny moments, bracken lethal company, lethal company monsters, nash pov lethal company, lethal company xbox, nash lethal company, lethal company skinwalker mod, bracken",1300000,26100,3983,8200000,"That Bracken really said, ""you lucky I'm holding him back"" 😂  #lethalcompany #lethalcompanygameplay #lethalcompanyfunnymoments #ifondo #ekspresimerdeka #dallascowboys #givingtuesday #ogmap #career #satisfy #леон",False,,kingkararick,King Kararick,,,,,,False
7300749822179478826,2023-11-12T20:18:11,119,US,,8423,4,10,158900,He is terrble.#movie #tiktok #brookyn99 #funnycouplevideos ,False,,funnymovie876,mr smile,,,,,,False
7307858898873109791,2023-12-02T00:05:08,208,US,"the waffle bus houston, keith lee, the waffle bus, keith lee effect, waffle bus, keith lee 10 ratings, the waffle bus houston after keith lee, keith lee new orleans, Keith Lee 10 Out Of 10, keith lee atlanta",936300,14100,7494,8900000,The Waffle Bus taste test 💕 would you try it ? 💕 #foodcritic #doordashpartner ,False,,keith_lee125,Keith Lee,,,,,,True
7304161946436209962,2023-11-22T00:59:12,0,US,"relatable tiktok videos, relatable tiktoks, Relatable Moments, girls girls girls, curious george song, how to ask a girl to hang out, curious george costume, Sad Relatable TikToks, Questions To Ask On A First Date, curious george",405400,5353,2352,2500000,#fyp #real #females #relatable ,False,,.brady07,.brady07,,,,,,False
7307258098547232046,2023-11-30T09:13:56,5,US,,78000,12000,353,805100,Terrible timing#fyp#foryoupage#foryou ,False,,gingervet,Adam,,,,,,False
7305532169441545504,2023-11-25T17:36:04,67,AT,"sam sulek, caseoh, CaseOh PS5 Messages, caseoh funny moments, provolone, queso pluma, kyrie serving, sylvester provolone, caseohgames, caseoh laughing at message",606100,6981,2048,3100000,CaseOh Reacts To HILARIOUS PS5 Messages😂😭 #caseoh #caseohgames #ps5messages #caseohfunnymoments #caseohclips ,False,,clipz.town2,Clipz Town,,,,,,False
7301839572537756971,2023-11-15T18:47:02,0,US,"helen keller, party in usa, helen keller speaking, hellen kellar ai cover, Helen Keller Saying Water, Party In The Usa, who is helen keller, water helen keller, songs by helen keller, hellen kellar sings ai",758200,106900,15100,7900000,MURICAAA 🇺🇸  #ai #aimusic #aimusics #aimusicscover #aicover #aimusicindustry #huhjackhuh #fyp #foryou #helenkeller #helenkellerisfake #partyintheusa ,False,,huhjackhuh,huhjackhuh 🐐,,,,,,False
7306664513070320929,2023-11-28T18:50:15,27,FI,,29100,1812,186,266400,avarage valvesintern enjoyer 💪🏼 #csgomemes #cs2 #ohnepixel #movemint #csgomovement #cs2funny ,False,,valvesintern,CS2 by VALVES INTERN 🔮,,,,,,False
7307353445332208938,2023-11-30T15:23:43,12,US,,43,1,6,951,From strugging to multitask to a full duck and cover 🫡 #vtuberclips #fyp #fnaf #jumpscare #twitch ,False,,monqueeeek,Monke,,,,,,False
7305898380352310559,2023-11-26T17:17:13,143,US,,3052,26,25,86900,A problem so hard even Google relies on Random Chance #problem #sohart #google #randomchance #foryourpage #vairal ,False,,breakingtapsthereal,Breaking Taps Real,,,,,,False
7306919817070595361,2023-11-29T11:20:50,12,GB,"captain holt, brooklyn 99, eyebrows, Brooklyn Nine-Nine, holt brooklyn 99, Jake Peralta - Brooklyn Nine-Nine, eyebrows filter, haley baylee eyebrow, Random Eyebrows, Captain Holt And Kevin",103000,494,212,868600,true friendship xx #brooklyn99 #b99 #friends #eyebrows ,False,,brooklyn99,Brooklyn Nine-Nine,,,,,,True
7306546723671919905,2023-11-28T11:13:05,60,GB,"north sea, the north sea, grand line sea, north sea oil rig, the black sea, sea scary videos, where is north sea?, ocean at night, red sea, north sea tiktoks",3600000,97700,28100,78500000,"The last clip will truly shock you😳 Have you ever been out on the North Sea before?  It is well known as one of the most dangerous seas in the world. It has wild storms and foggy winters. Because the sea is mostly shallow, the currents are strong and often pull in different directions. Not only one of the most dangerous in the world but also the coldest (it has an average temperature of 17°C in summer and 6°C in winter)🥶  credit @Aivis Dornis #northsea #ocean #explore #adventure #fyp ",False,,ukdestinations,The North Sea,,,,,,False
7307113737394081067,2023-11-29T23:53:37,15,US,,8,0,1,247,Live stream clippings 😤#valorant #foryour #foryourpage ,False,,heike.has.arrived,Heike Has Arrived,,,,,,False
7301945521365585154,2023-11-16T01:38:01,0,US,,91700,2886,1247,883800,the dating scene is rough out there…,False,,hannahpattyyy,hannah,,,,,,False
7306973568070339886,2023-11-29T14:49:39,69,US,"matt rife, Andrew Schulz, Taiwan, andrew schulz palestine, andrew schulz australia, Stand Up Comedy, black faces navy seals, andrew schulz aboriginals, friday night lights, comedian",2700000,218500,13600,23200000,If CHINA invades TAIWAN... I've got a plan. LA FORUM #TheLifeTour is coming. Public On-Sale starts 10am PST. Link in bio (don't get screwed by scalpers) Great edit @Chifftie :)  #TheLifeTour #andrewschulz #losangeles #china #taiwan #standupcomedy #fyp #comedy ,False,,theandrewschulz,Andrew Schulz,,,,,,True
7306956857959042350,2023-11-29T13:44:55,74,GR,,151000,1524,371,1400000,What just happened??😳 #valorant #valorantchampions #VCTgamechangers #tarik #esports ,False,,therealtarik,Tarik,,,,,,False
7306173433706990878,2023-11-27T11:05:39,132,US,,106700,6572,1070,958000,"Going ALL OUT with Caribbean food at @The Grotto BK in Bedstuy, Brooklyn NYC! 🇯🇲🍗🧀🍝🔥🤤 This was also our first time trying ackee with saltfish and we loved it! 👌 Love this spot. Thank you for everything, chef! 🙏 #DEVOURPOWER #fyp #foryou #foodtiktok #caribbeanfood #jamaicacfood #jamaican #shrimp #jerksauce #jerkseasoning #brooklyn #thegrotto #thegrottobk #bedstuy #bedstuybrooklyn #nyc #nycfood #newyorkcity #nycfoodies #nycfoodblog ",False,,devourpower,DEVOURPOWER,,,,,,True
7306870986278849824,2023-11-29T08:11:24,10,GB,"orange cat, cats are liquids, Orange Cat Behavior, orange cat activities, cat videos, Cats Meowing, mainecoon cat, Cats Of TikTok, cute cats, Sphynx cat",7600000,396900,50200,57500000,Normal orange cat activities 💀💀 #Memezar (Misty Dane via @ViralHog),False,,memezar,Memezar,,,,,,True
7299646754524532011,2023-11-09T20:57:47,0,US,,67000,2570,808,547400,#fyp #viral #medpasta ,False,,medpasta,Med,,,,,,False
7306889685698235691,2023-11-29T09:24:15,70,US,,178300,1039,440,920800,THIS COLLAB ATE #lesserafim ,False,,yejimunchinn,.,,,,,,False
7294657627282296071,2023-10-27T12:00:00,20,ID,"le sserafim, chaewon, perfect night, chaewon perfect night, chaewon hiatus, yunjin perfect night, le serafim mr perfect night, chaewon fancam, perfect night le serafim lyrics, Chaewon Edit",211500,2319,455,1700000,#lesserafim #chaewon,False,,vidslab,𝑨𝑴𝑩𝒀𝑨𝑹,,,,,,False
7286296425896480043,2023-10-04T22:31:44,73,US,"chaewon, jungkook comments on chaewon, Jungkook, chaewon jungkook, jk commenting on chaewons post, Jungkook Comment Chaewon, jk comment on chaewon, chaewon and jungkook, chaewon jim beam, chaewon dododo",62500,2264,295,480600,WE CANNOT COMPETE 😭 #jungkook #chaewon #정국 #bts #btsarmy #kpop #korean #asian #fyp #xyzbca #foryou #justinjang ,False,,justin._.jang,Justin Jang,,,,,,False
7306914498768604448,2023-11-29T11:00:13,10,GB,,115300,196,216,1000000,meet… nefarious Holt #brooklyn99 #b99 #captainholt ,False,,brooklyn99,Brooklyn Nine-Nine,,,,,,True
7305505644826627361,2023-11-25T15:53:07,6,GB,"The Basement Yard, Basement Yard, the basement yard funny moments, Frankie And Joey, Charles Boyle, Joe Santagato, joe santagato edit, frank alvarez, frank alvarez and joe, basement yard podcast",508400,7493,829,2500000,#frankalvarez #joesantagato #thebasementyard #santagatostudios #thebasementyardpodcast #joesantagatoedit #frankalvarezedit #fyp #thebasementyardedit #foryou #fypシ #xyzbca #viral #viralvideo #dontflop #foryoupage #dontletthisflop #plsgovirall #jfsantagato #relateable ,False,,tby.best.moments,mya💐,,,,,,False
7305821752301702446,2023-11-26T12:20:00,18,US,"funny cod moments, Funny Gaming Moments, Funny Moments, gaming, Funny Game, Gaming On TikTok, Funny Bloopers, driving wheel gaming funny moments, Gaming With A Steering Wheel, Funny Jokes",314200,4892,314,2400000,HE BACKPEDALED REAL QUICK 😂 #fyp #gaming #funnymoments #gamingfunnymoments #callofduty ,False,,constant_jitters,Constant Jitters,,,,,,False
7306439134862757152,2023-11-28T04:15:44,0,GB,"spotifywrapped, brainstew, Brain Stew Song By Green Day, Spotify Picture Frame, music wrapped, spotify wrapped 2023 message, spotify wrapped personality, sza spotify wrapped, spotify song lyrics, melanie martinez spotify wrapped",892100,19700,2220,6500000,wth #spotify #spotifywrapped #spotifywrapped2023 #meme #brainstew #fyp ,False,,69dorito420,69dorito420,,,,,,False
7305798227369004320,2023-11-26T10:48:30,8,SK,"sam sulek, jadies and letterman dilo, let's see how many can hold me dild, how many things can hold me, how many 100 dollar bills can hold me, ladies and gentlemen how many can hold me, let's see how many can hold me, how many 100 bills can hold me, gadies and letterman noodles, Cat Videos",3700000,177500,22600,24900000,🐱#fyp #flop ,False,,burgerinmyasss,butger,,,,,,False
7305919748477340970,2023-11-26T18:40:12,10,US,"josh giddey draft, josh giddey interview, josh giddey is innocent, josh giddey memes, josh giddey voice, josh giddey talking, joshgiddeyenjoyer, Nba, Basketball NBA, joshgiddey 16",559200,28600,3960,3900000,😭😭 #joshgiddey #nba #fyp #viral ,False,,silkylol,silkyclipz,,,,,,False
7305843967017372959,2023-11-26T13:46:07,6,US,,1000000,11600,2692,11200000,Real,False,,mr.redcup,Mr. Red,,,,,,False
7305796380277198122,2023-11-26T10:41:31,10,US,"baja blast scream, alex calderon scream, chicken mother nuggets, bajaaaaaaaaaaaaaa blast, alexcalderonwdgcop, alex calderon, bajajaha blast, tie fighter scream, baja blast, alex calderon baja blast",1600000,110100,9688,11600000,mcdonalds #fypシ #HotwireHotelGoals #TakisTransformation #PerfectAsWeAre #original #horror #foryoupage,False,,alexcalderonwdgcop,alexcalderonwdgcop,,,,,,False
7304869436094303519,2023-11-23T22:44:34,165,US,"Basement Yard, The Basement Yard, women's suffrage, women's suffrage basement yard, women suffrage meaning, the basement yard suffrage, 'The Basement Yard' Podcast, basement yard suffrage, basement yard podcast, Podcast Clips",133100,3244,519,959100,Suf·frage: The right to vote in political elections. #thebasementyard #thebasementyardpodcast #podcast #clips #podcastclips #funny #viral #fyp #joesantagato #santagatostudios #frankalvarez,False,,basementyardclipz,The Basement Yard Clips,,,,,,False
7304043937226919210,2023-11-21T17:21:05,0,US,,30600,1601,486,340400,Just wrong fr💀 #fypシ #relatable #viral #foryoupage #fyp #5thgrade ,False,,toe_taco3000,_Taco_,,,,,,False
7303738683419626794,2023-11-20T21:36:30,11,US,,125500,29900,926,1200000,id give you my last crayon#trucktok #fyp #20x10s #33s #truck #relateable ,False,,ashnewcomb23,Ashton Newcomb,,,,,,False
7304706529666534698,2023-11-23T12:12:14,60,US,"caseoh, CaseOh PS5 Messages, caseoh funny moments, fi fy fo fum, caseoh games messages on ps5, gaming, caseohgames, PS5, Playstation, video games",70000,919,372,402600,Yes it does 😭#CapCut #foryou #caseoh #fyp #fy #fypシ゚viral #fypシ#fyppppppppppppppppppppppp #fypdongggggggg #fypage #twitch #caseohgames #viral #funny #streamer #caseohclips #biggeststreamer #gaming #fallguys #playstationmessages #ps5messages #messages ,False,,caseohcorp,CaseOhCorp,,,,,,False
7304780321927679278,2023-11-23T16:58:34,6,US,,543400,85900,1871,3700000,Am i not loved #thanksgiving ,False,,ren_talli,LAUREN TALLI,,,,,,False
7305057893903109418,2023-11-24T10:55:49,35,US,,733800,35700,6704,5900000,Just wait for it 🤣,False,,cainp9,Cain Perez,,,,,,False
7305741730635205919,2023-11-26T07:10:20,15,US,,737800,20200,1408,6500000,#funny #funnyvideos #foryou #fyp,False,,super_omg36,Super OMG,,,,,,False
7296232421006052638,2023-10-31T17:08:21,8,US,"jujutsukaisen memes hands, Jujutsu Kaisen Opening, anime, Jujutsu Kaisen, sign language, Jujutsu, Jujutsu Kaisen Anime, Anime TikTok, With This Treasure I Summon JJK, Gojo Jujutsu",119900,5748,268,537700,please don't unmoot me guys 😿 (fake everything) #jjk #jujutsukaisen #anime #fyp #meme ,False,,dxrkistaken,dxrk,,,,,,False
7305972134252170527,2023-11-26T22:03:27,0,US,"Sad Videos, sad relatable videos, Sad Relatable TikTok, relatable tiktok videos, sad tiktoks, Relatable TikTok, Relatable Moments, Sad Story, Sad Mood, sad mood feelings",929700,27400,10700,6000000,#relatable#sad#deppresed ,False,,tx.andrez,andres,,,,,,False
7306006217095138603,2023-11-27T00:15:49,14,US,"nobody knows this, no one knows this but im carrying, isthisajoek, no one knows this but i am actually carrying, no one knows this but, no one knows this but i'm actually carrying an original, conceal carry",785800,46800,3253,4500000,You wouldn’t even know. #airsoft #fakeguns⚠️ #fakegun #airsofter ,False,,isthisajoek,It’s just Joe,,,,,,False
7306221097345699102,2023-11-27T14:09:41,131,US,,33700,850,125,423400,"Do yourself a favor and swing by @Best Bagel and Coffee NYC in Midtown, Manhattan! 🥯🗽🥇🔥 Flawless bagels, cream cheeses, bagel sandwiches, and coffee coming out of this spot. 👌 #DEVOURPOWER #fyp #foryou #foodtiktok #bestbagelsnyc #bestbagelandcoffee #bagelsnyc #nycbagels #bagelnyc #nycbagel #bagelmaking #bagels #bec #baconeggandcheese #baconeggandcheesebagel #nycfood #nycfoodies #nycfoodblog #newyorkcity #newyorkcitybagels ",False,,devourpower,DEVOURPOWER,,,,,,True
7284286666355887393,2023-09-29T12:32:38,13,GB,,45300,141,50,336200,trust jake to find the weirdest way to compliment amy any day 😌 #brooklyn99 #b99 #jakeperalta ,False,,brooklyn99,Brooklyn Nine-Nine,,,,,,True
7289780415768939809,2023-10-14T07:51:12,11,GB,"minji, Newjeans, minji live, danielle new jeans, minji new jeans, New Jeans Performance, minji speaking english, newjeans_official, New Jeans Pants, minji english",183800,6118,645,1200000,“ that's— ” girl was hesitating to say smt 😭 #minji #newjeans #fyp ,False,,hanni4pham,flo,,,,,,False
7298423734342405422,2023-11-06T13:52:05,7,US,,442100,82900,1296,5900000,What!? #warehouseworker #forkliftcertified #bossesbelike #workflow #workhumor #workstruggles #CapCut #Meme #fyp #funny #CapCut ,False,,watdafork1,Carl,,,,,,False
7304988287494622466,2023-11-24T06:25:45,52,GE,,132400,111,128,893600,Female idols who went viral for the way they talk #felixcomm #fyp #kpopfyp #viral #viral ,False,,felix_comm,felix_comm,,,,,,False
7302545143507258654,2023-11-17T16:25:02,148,US,,75200,52,294,928000,Mappa needs to be treated good LOOK AT THIS 😩 #sukuna #sukunavsjogo #jogojujutsukaisen #animetiktok #jjkanime #jjkseason2 #jujutsukaisen #keronsensei #jogo #animereaction ,False,,keronsensei,keron sensei,,,,,,False
7305696975066762501,2023-11-26T04:15:35,0,PH,,296600,1593,1237,1900000,kdrama men's and their dramas pt 1.>>>#choihyunwook#ryeoun#byeonwooseok #leeminho #yangsejong #chaeunwoo #hwangminhyun #parkjihoon #leejaewook #gongyoo #namjoohyuk #ahnhyoseop #kdrama #foryoupage #fyp ,False,,1choi_hyunwook,😉🍉,,,,,,False
7298073051499973921,2023-11-05T15:10:52,9,DE,,1000000,30200,1956,7200000,#funnyvideos #catsoftiktok #hideandseek ,False,,funnyshit042,funny shit,,,,,,False
7278265709854002465,2023-09-13T07:08:19,54,PK,"rhythm hive, how to download rhythm hive, rhythm hive new jeans, hanni, hanni speaking vietnam, NewJeans, Bbangsaz, minji playing rhythm hive, rhythm hive tutorial, minji new jeans",539100,13400,2385,3900000,hanni is so cute 😭😭 minji encouraging her aww #bbangsaz #hanni #minji #newjeans #fyp ,False,,hanni4pham,flo,,,,,,False
7296571791797947681,2023-11-01T15:05:12,25,IT,"Joshua Reaction To His Iconic Mistake, Seventeen, joshua seventeen, pretty u seventeen, seventeen mistake, pretty u, seventeen members, pretty u original vs mistake, kpop mistakes on stage, seventeen joshua mistake",1300000,5466,2042,8100000,8 years ago and this still the best miskate in kpop🤧 #svt #seventeen #joshua #carat #kpop #fyp #viral ,False,,beomstein,(SEEING SKZ‼️) Kkultarae🦆🤍,,,,,,False
7306395893228440862,2023-11-28T01:28:09,9,US,,2,0,0,264,#chinese #learningchinese #learnontiktok #mandarin #characters #chinesetiktok #chinesecharacters #fyp ,False,,s.louis02,S.Louis,,,,,,False
7306394707603524895,2023-11-28T01:23:30,163,US,,4,0,0,268,high power lasershows welcome to inquiry #lasershows #lasermoudle #lasershowsystem #optlaser ,False,,luckyoptlaser,Lucky-optlaser,,,,,,False
7305900366871170346,2023-11-26T17:24:56,5,US,,108200,5724,509,1300000,post meeting naps hit differently ngl #wfh #swe #fyp ,False,,tparkk,Tony Park,,,,,,False
7304619295277862176,2023-11-23T06:33:42,34,GB,,332700,19400,982,3500000,"Lethal Company is taking the gaming world by storm, what a funny game 😂⁠ ⁠ (📽️ Via @nepushi)",False,,gamingbible,GAMINGbible,,,,,,True
7305496010485239073,2023-11-25T15:15:45,6,GB,,1100000,47100,6638,8000000,@TheRaiments about to drop baby🔥 Join mailing list in bio so you can get an email when it drops⚡️,False,,conallsraiments,Conall Doyle,,,,,,False
7305910595751202094,2023-11-26T18:04:40,32,US,,4500000,120600,9917,27100000,100% planned 🤣💀 #fy #fyp ,False,,conigliaro12,Cayla C.,,,,,,False
7305774507153706271,2023-11-26T09:16:45,99,US,"kittens eating raw meat, kittens eating raw meat metal music, kitten eating, kittens meowing, cat meowing, kitten eating salmon, kitten demolishes, kitten demolishes steak, Salmon, kitty eating raw food",1400000,54400,8480,9700000,Salmon did not have a chance! #fyp #foryou #foryoupage #kitty #tuna #rock ,False,,_video._.clipz_,videoclips,,,,,,False
7299778888178093319,2023-11-10T05:30:20,36,KR,"aespa_official, perfect night, Aespa, Karina | Aespa, chaewon, le sserafim, karina, perfect night dance tutorial, aespa メンバー 紹介, Kim Chaewon",2600000,28800,13900,21400000,🐱Perfect #KARINA ænergy🥰 #aespa #에스파 #카리나 #LE_SSERAFIM #르세라핌 #KIMCHAEWON #김채원  #Perfect_Night @aespa official ,False,,le_sserafim,LE SSERAFIM,,,,,,True
7301715934090136838,2023-11-15T10:47:05,27,CA,"Enoki Beef Rolls, enoki wrapped beef, enoki mushrooms, enoki, beef recipes, Things To Make With Ground Beef, beef recipes ideas, Food Recipes With Ground Beef, Meals With Ground Beef, Rolls Recipe",74100,2988,157,1100000,Enoki Beef Rolls 😮‍💨,False,,iankewks,Ian,,,,,,False
7304831814168874283,2023-11-23T20:18:27,6,US,,489300,28300,2488,3200000,This is a reminder to you all 😔 #kitty #kittycat ,False,,m450581,M,,,,,,False
7301821450942549290,2023-11-15T17:36:42,9,US,,188900,23100,453,1900000,How does this happen? #sales #saleshumor #carsalesman #yoshi #car ,False,,saxon_reinhart,Saxon Reinhart,,,,,,False
7302262087051382047,2023-11-16T22:06:28,0,US,,498400,45500,5171,4400000,#fyp #foru #babykittenrizz #babykitten #kittentok #kittenrizz #rizzgod #foryoupage #gf #bf #pickuplines #smooth #pickup #lines #rizzler ,False,,kitty.rizzler,Kitty Rizzler,,,,,,False
7303313659244170538,2023-11-19T18:07:18,0,US,,129100,8260,671,1200000,LOL i- can’t breathe ,False,,abdiiiels,Abdi,,,,,,False
7305893992569277739,2023-11-26T17:00:13,221,US,,356700,9879,894,3600000,i love those types of conversations. everyone has a theory of their own but nobody can be 100% sure in the end  #qna #tumblr #meme #relatable #funny #texts #tweets #piratesofthecaribbean #davyjones ,False,,entertainment.sauce,Entertainment Sauce,,,,,,False
7306393535496883498,2023-11-28T01:18:59,15,US,,10,0,0,845,Teaching people about Coilheads the good old fashioned way #lethalcompany  #teaching  #coilhead #lethalcompanygame,False,,arandom_shadow,ARandom_Shadow,,,,,,False
7302130080107597102,2023-11-16T13:34:32,39,US,"Jungkook, standing next to you, idols reaction to jungkook standing next to you, jungkook standing next to you, standing next to jungkook, bts, jungkook m countdown, idols reaction to jungkook, standing next to you dance tutorial, standing next to you mnet",438100,2663,1337,2700000,Imagine performing after jungkook 😭i-  #jungkook #standingnexttoyou #bts #jk @AbjkMRstY #loverofnamseok #imahoefornamseokssmile #mnet #bighit_official_bts #kpopfyp ,False,,loverofnamseok,vivi⁷♡,,,,,,False
7290356984065412382,2023-10-15T21:08:41,87,US,,27800,427,57,359000,Best Of Petet Griffin Season 5-6 | Part 2 #familyguypeter ,False,,quyfamilyguypeter,Family guy Peter,,,,,,False
7286897362537139502,2023-10-06T13:23:47,100,US,,298100,26800,3052,3000000,Never seen a car with three-step verification via @elpoderosoimpactoshow,False,,hy88231w0i,hy88231w0i,,,,,,False
7295582092526751022,2023-10-29T23:04:51,0,US,,2995,80,23,49700,Japanese foods are some of my personal favs #fyp #fypシ #xycba #slideshows #slideshowtrend #tagsomeone #pintrestaesthetic #chooseone #thisorthat #viralvideo #food #love #japan #japanese #japanesefood #hungry #eliminated #yummy,False,,espin.darling,ᰔ ⊹ ˚₊ espin darling ₊˚⊹ ᰔ,,,,,,False
7300368885813906718,2023-11-11T19:39:58,97,US,"gojo vs hanami, sukuna vs jogo, Gojo, gojo vs jogo, gojo domain expansion, satoru gojo, Gojo Jujutsu, Jujutsu Kaisen Gojo, gojo walk, Jujutsu Kaisen: Satoru Gojo",116000,522,442,1400000,Bro look like the villain #jujutsukaisen #gojo #gojosatoru #satorugojo #hanami #jogo #shibuyaarc #anime ,False,,yonkolvl1,YonkoLvl,,,,,,False
7305601189108927774,2023-11-25T22:04:01,0,US,,46900,6640,91,613900,Yeah. #fyp #santaclaus #christmas #real #relatable ,False,,plsmek,★,,,,,,False
7305450592644713761,2023-11-25T12:19:30,20,IT,,343900,14600,3953,3000000,Peak #onepiece #anime #luffy #strawhat #dontletthisflop #foryou ,False,,straw_hat00,StrawHat,,,,,,False
7285050914228997409,2023-10-01T13:58:18,42,DE,"eve psyche and the bluebeard's wife concert, les serafim eve psyche and the bluebirds wife, le sserafim, le serafim eve psyche and the bluebird concert, le sseráfim eve psyche the bluebeard, lee serafim eve psyche, eve psyche bluebird's wife, eve psyche and the bluebeard's wife mama, sakura lesserafim, eve psyche and the bluebeard's wife live",190500,3486,399,929700,pls they are so funny😭😭 #lesserafim #르세라핌 #sakura #chaewon #yunjin #kpopsidedish ,False,,kpopsidedish,banchan,,,,,,False
7304566276221930760,2023-11-23T03:07:52,48,NP,"Vernon, vernon english tutor, vernon tutoring fan, kpop idols surprising fans, idols surprising fans, seventeen surprising fans, vernon seventeen, kpop idols being shocked by pretty fans, seventeen, my celebrity tutor vernon",392500,2214,867,2700000,Her reaction was priceless 😂 Vernon was so fluttering#seventeen#vernon ,False,,s.cuops77,carat 🍒[SEVENTEEN🩵],,,,,,False
7305405242479299883,2023-11-25T09:23:53,92,US,"united flight 501, funny pilot announcement, funny pilot, flight announcement, pilot, Aviation, Delta Flight, pilot funny moments, Funny Moments, Delta Airlines",411000,4929,501,4500000,HILARIOUS DELTA PILOT IN FLIGHT ANNOUNCEMENT 😂 #delta #pilot #aviation #travel #announcement ,False,,flightsimstuff,Flight.Simulator.Fantasy,,,,,,False
7305634847693737247,2023-11-26T00:14:37,13,US,,610,46,5,7623,forgot the creds of who i got the idea from #MemeCut #Meme #valorant,False,,nxtmxggie,M 💗,,,,,,False
7296562111260462378,2023-11-01T14:27:53,0,US,"Disney 100, dating, Dating Scene, Going On A Date, movie theater date, dating in the kitchen, first date, dating wrapped, Romantic Date Ideas, Dating In NYC",954000,19800,9473,5200000,dating in your mid twenties >>>> 😍😍😍#fyp ,False,,livvhm,liv,,,,,,False
7306028669749710088,2023-11-27T01:42:42,221,AU,"rhythm heaven, pose for the fans rhythm heaven, dashie rhythm heaven, rhythm heaven remix 10, how to play rhythm heaven, minus 8 rhythm heaven, rhythm heaven vtuber, rhythm heaven perfect, rhythm game, i'm just a man missing you rhythm heaven",2000000,5500,3531,14500000,SO HAPPY to see this game came back after 12 years! remix 10 100% #rhythmheaven #remix10 #rhythmgame #hsblue #rhythmheavenfever ,False,,hsblue,hsblue,,,,,,False
