video_id,video_timestamp,video_duration,video_locationcreated,suggested_words,video_diggcount,video_sharecount,video_commentcount,video_playcount,video_description,video_is_ad,video_stickers,author_username,author_name,author_followercount,author_followingcount,author_heartcount,author_videocount,author_diggcount,author_verified
7315228901805100334,2023-12-21T20:44:24,208.0,US,"my wife has been insisting we have a 3, wife's perspective reddit, wife's perspective story, marriage story, Storytelling, sister wives, my wife has been insisting we have a 3 update, whats the creepiest thing you have ever done reddit, my wife has been insisting on sleeping, my wife has been insisting on sleeping update 2",26900.0,159.0,1268.0,569900.0,"Replying to @ffredinho_23 WIFE’S PERSPECTIVE - My WIFE has been INSISTING that we have a 3 WAY with my SISTER. When I put my FOOT DOWN and told her NO, she took MATTERS into her OWN HANDS
 #reddit #redditstories #redditreadings #askreddit #fyp #satisfying #redditfeeds
 This story may be adapted for more entertainment.",False,,redditfeeds,Reddit Videos,,,,,,False
7315223431694290218,2023-12-21T20:23:08,101.0,US,"my wife has been insisting we have a 2, Storytelling, my siblings refused weddings story, sister wives, whats the creepiest thing you have ever done reddit, it should have been you baby text reddit",25100.0,113.0,147.0,367300.0,"Replying to @connormalloy5 Update - My WIFE has been INSISTING that we have a 3 WAY with my SISTER. When I put my FOOT DOWN and told her NO, she took MATTERS into her OWN HANDS.
 #reddit #redditstories #redditreadings #askreddit #fyp #satisfying #redditfeeds
 This story may be adapted for more entertainment. ",False,,redditfeeds,Reddit Videos,,,,,,False
7315212040757398827,2023-12-21T19:38:57,271.0,US,,76200.0,518.0,769.0,1000000.0,"My WIFE has been INSISTING that we have a 3 WAY with my SISTER. When I put my FOOT DOWN and told her NO, she took MATTERS into her OWN HANDS.
 #reddit #redditstories #redditreadings #askreddit #fyp #satisfying #redditfeeds
 This story may be adapted for more entertainment.",False,,redditfeeds,Reddit Videos,,,,,,False
7315089045439171873,2023-12-21T11:41:36,0.0,GB,,103000.0,11200.0,1972.0,1000000.0,🤷🏼‍♀️🤷🏼‍♀️ #dateideas #redthoughts #viral #love ,False,,sex.thoughts,red thoughts,,,,,,False
7306701271753395499,2023-11-28T21:12:59,85.0,US,"impacted hair follicles, waxing impacted hair follicles, impacted hair, impacted hair removal, hair splinters, hair follicle extraction, hair splinter removal, hair ingrown removal, Dog Hair, doggrooming",238400.0,4112.0,1085.0,14600000.0,For y'all who always want to see more. We've gone full out impacted hair follicle plucking #greatdane #doggrooming #grossola #fypシ #satisfyingvideo ,False,,lovemargot.co,Lovemargot.co,,,,,,False
7295441936976989483,2023-10-29T14:00:55,120.0,US,,3100000.0,31700.0,15000.0,69900000.0,#movieclips4yu #movie #moviescene #movietok #filmclips #moviescenes #nicemovies #moviestowatch ,False,,ohhappydays2,Tata,,,,,,False
7314580340264406318,2023-12-20T02:48:11,214.0,AU,"notbzy, drop shipping, notbzy job, notbzy retiring parents, retiring parents, drop shipping for beginner, dropping shipping, retiring my parents reaction, kai cenat mom so proud, paul han parents",2100000.0,17100.0,12600.0,20000000.0,Imagine making enough money to retire your parents?! ♥️🤷🏽‍♂️ With @notbzy #fyp #foryou #love ,False,,gloss,GLOSS,,,,,,True
7305804426516876590,2023-11-26T11:12:44,303.0,US,,101100.0,506.0,889.0,2100000.0,"15 years, 2 kids, perfect life, then my wife’s “harmless” friend put a baby in her. #reddit #redditreadings #redditstories #askreddit ",False,,looprevenge,Loop Revenge,,,,,,False
7314990338039647534,2023-12-21T05:18:46,0.0,US,,108200.0,7798.0,879.0,865200.0,#leagueoflegends #gaming ,False,,komarilol,Komari,,,,,,False
7311817174698462497,2023-12-12T16:05:03,65.0,GB,,55000.0,56.0,65.0,1400000.0,How has he managed to do that 😭 #fortnite #fortniteclips #ogfortnite #fortnitenostalgia #oldfortnite #legofortnite ,False,,antzfn,AntzFN Clips 🎥,,,,,,False
7293175043465497889,2023-10-23T11:24:04,71.0,GB,,213000.0,229.0,548.0,2000000.0,things ex staff said about kpop idols pt 3 #kpop #kpopfyp #kpopviral #viral #fyp #kpopfacts #wncts #lesserafim #blackpink #bts #ive #itzy #‎unflopme ,False,,wncts,⋆,,,,,,False
7306704970387148075,2023-11-28T21:27:16,6.0,US,,28100.0,833.0,65.0,323200.0,Mandatory. #fyp #foryou #foryoupage #gym #gymbro #gymlife #gymtok #fittok #d1 #athlete ,False,,larrygao,Larry Gao,,,,,,False
7302815951865629984,2023-11-18T09:55:46,0.0,DE,"Blueberry Faygo, life is good drake, blueberry faygo dance, life is good, blueberry faygo lyrics, out west travis scott, no suburban, The Box, The Box Roddy Ricch, addison rae blueberry faygo",1300000.0,6142.0,4418.0,6600000.0,#foryoupage ,False,,tonycartiier,🙏🏾,,,,,,False
7310464902454349061,2023-12-09T00:37:33,18.0,US,"ice cream vending machine, It's Like A Reward, Ice Cream Machine, vending machine, ice cream vending machine library, Machines, Ice Cream, Ice Cream Maker Machine, Ice Cream Maker, ice cream vending machine at school",1100000.0,3834.0,1967.0,6400000.0,im never getting one again #whyisitsoloud #library ,False,,andykimz,⭑andy⭑,,,,,,False
7295680027826425120,2023-10-30T05:25:02,60.0,FR,,4100000.0,37800.0,14300.0,175600000.0,6 mystery videos #scaryvideos #scary #horror #mystery ,False,,scaryviideos,Scary Videos,,,,,,False
7314467558126554400,2023-12-19T19:30:14,61.0,US,"north sea, real life pirates, piracy at sea, us navy vs pirate, Modern Day Pirates, modern pirates, north sea tiktoks, pirates encounter at sea, cruise ship pirates, the north sea",3200000.0,53400.0,29900.0,63300000.0,#scary #ocean #sea #pirates ,False,,rocing.boy88,Asmr Ocean,,,,,,False
7314851305694956830,2023-12-20T20:19:05,5.0,US,"how to know what side of the family i am, realizing i'll be the mom side, dad side of family, family, Dad Filter, Brothers, family bonding",3600000.0,34900.0,18400.0,28300000.0,there’s NO way #fyp #foryou #relatable ,False,,avaminaa,AVA MINA,,,,,,False
7305194533136911658,2023-11-24T19:45:59,19.0,US,,67300.0,859.0,267.0,481400.0,"And we have to pay extra for labs for some reason + buy our own textbooks, lab coats, calculators, etc. #studentdebtcrisis #pokimane #capitalism ",False,,harry.hj.kim,Harry Kim,,,,,,False
7305967443384519979,2023-11-26T21:45:20,82.0,US,"hyper parasitic wasp, Drone, Drone Videos, Drones In The Sky, Drone Flying, Drone Videography, Drone Filmed Videos, drone camera, Drone TikTok Camera, Drone Sky Show",85900.0,1983.0,1063.0,1600000.0,#tiktok #fyp #drone #insectworld ,False,,micro.monsters0,Micro Monsters,,,,,,False
7313922715616939270,2023-12-18T08:15:39,0.0,CA,,639500.0,14200.0,8995.0,6000000.0,#animewinter2024 #upcominganime2024 #anime2024 #sololeveling #blueexorcistseason3 #animerecommendations ,False,,zoronews1,Zoronews,,,,,,False
7298910328669326638,2023-11-07T21:20:04,158.0,US,,91700.0,151.0,122.0,1700000.0,This man lost three million dollars in ten seconds. #tiktok #foryou #fyp #fypシ ,False,,dysymovie7,Dysy movie,,,,,,False
7300414739799084321,2023-11-11T22:38:13,30.0,US,,217600.0,1832.0,283.0,1800000.0,video funny & cute  #funnyvideos #meme #cute #fyp #viral #humor #usa ,False,,memefunnys0,Bruh 😎,,,,,,False
7307748328941407530,2023-12-01T16:56:02,64.0,US,,190300.0,854.0,2102.0,4600000.0,,False,,idksterling,IdkSterling,,,,,,False
7303507441088564522,2023-11-20T06:39:41,117.0,US,,404600.0,571.0,766.0,12500000.0,#reddit #stories #redditstories #redditreadings #story #fyp ,False,,fkkfd2,fkkfd,,,,,,False
7300632757150043425,2023-11-12T12:43:50,69.0,GB,"stalkers in japan, japan stalker apartment, japan, japan stalker caught, alexandria japan stalker, alexandria japan, living in japan is scary, stalkers in japan caught on camera, japan convenience store, Japan Travel",3300000.0,22700.0,26800.0,51900000.0,how do people sleep at night? #japanlife #stalker #staysafe ,False,,itsgoneviral,It's Gone Viral,,,,,,True
7293581996167548202,2023-10-24T13:43:22,5.0,US,,2500000.0,31200.0,10000.0,29800000.0,like how #fyp #foryoupage #relatable ,False,,anthonypert,Anthony,,,,,,False
7314521941866581253,2023-12-19T23:00:56,13.0,CA,"Fat Cats, Mainecoon Cat, Cat Videos, Cat Meowing, funny cat, Funny Cat Videos, Funny Videos With Cats, Funny Kittens, cats of tiktok, Funny Cat Moments",1200000.0,38500.0,7747.0,11600000.0,I think grandma needs to take it easy on the cat food😂… #fatcathappycat #funnycatvideo ,False,,kittensgonecrazy,CATS AND KITTENS,,,,,,False
7315136818167418154,2023-12-21T14:47:01,161.0,US,"i sued my teacher and it made me rich, i sued my teacher 2, i sued my ableist teacher, i sued my teacher update 2, overactive bladder, overactive bladder reddit story, i sued my a plus teacher, Satisfying Videos, Satisfying, Satisfying Things",379800.0,523.0,1755.0,8200000.0,Part 1🤒#satisfying #storytime #asmr #foryou ,False,,redditpoll,Poll,,,,,,False
7299328187283098913,2023-11-09T00:21:34,125.0,US,,21100.0,36.0,279.0,908500.0,The most heartbraking moment in the history of fencing #fencing#tiktok #fyp #foryou ,False,,6rnopdkkn,6rnopdkkn,,,,,,False
7311666439058902302,2023-12-12T19:00:00,86.0,US,,1844.0,7.0,9.0,182800.0,PART3 ☑️ Hand over all your #movie #film #series #show #foryou #movies #netflix #4u #fyp,False,,ramon_movies,Ramon MV,,,,,,False
7306935362474020126,2023-12-08T16:00:00,64.0,US,"bluebloods homeland security gets fired, bluebloods, Homeland Security, blueblood homeland security scene, abdel salem blueblood, bluebloods abdel salem ending scene, blueblood homeland security ending, bluebloods homeland security, bluebloods homeland security gets fired episode, movie clips",1200000.0,2913.0,4752.0,43600000.0,PART1 ☑️ The poor man offended the wrong #movie#film #series #show #foryou #movies #netflixu #fyp  #4,False,,ramon_movies,Ramon MV,,,,,,False
7296781567827954976,2023-11-02T04:39:17,161.0,GB,,1300000.0,11700.0,2517.0,17700000.0,@#2 Pogo Playz How did theif got an translater Job? 🤯🙈 #awkwardpuppets #funny #gaming #foryou #fyp #viral ,False,,amigos.es.x4in,#1 FUNNYZ_PLAY,,,,,,False
7314946226108271918,2023-12-21T02:27:35,109.0,US,"saiga antelope fighting, male antelope, saiga antelope meat, animal videos, Animal, Animals Of TikTok, Seal Animal, funny animal, Animal World, funny animal videos",1100000.0,58800.0,17100.0,15000000.0,The male antelope is kind of funny. #animalworld #foryoupage #trend #fyp #vrial #tiktok #hunter ,False,,linette303z,linette,,,,,,False
7314897853405777198,2023-12-20T23:19:48,0.0,US,,106600.0,3889.0,736.0,643700.0,it’s just not their year 💔 #sharks #hockey #nhl #sadfactsaboutsharks #sanjosesharks ,False,,em.ugh,em :),,,,,,False
7309213825365036330,2023-12-05T15:43:00,379.0,US,"Candy Making, candy cane making, loganscandies, ribbon candy, candy cane, homemade candy canes, Dragon's beard candy, candy cane gone wrong, candy stuck on counter, how to make candy canes",5700000.0,57400.0,19500.0,84300000.0,Peppermint Candy Canes: trust the process 😍🎄🎅🏼,False,,loganscandies,loganscandies,,,,,,False
7313287726466469152,2023-12-16T15:11:35,8.0,IT,"ohayo onii chan meaning, ohayo onii chan guy, ohayo onii chan old man, ohayo onii chan meaning hand movements, Me If You Even Care, ohio onii chan meme, this is me if you even care",3000000.0,68900.0,29000.0,16200000.0,PLSSSS ,False,,otrbs,rebecca,,,,,,False
7314434643166547230,2023-12-19T17:22:20,0.0,US,,15400.0,1871.0,450.0,137500.0,#stonybrookuniversity #stonybrook #chatgpt #chatgpt4 #dalle3 #wolfieisgod #seawolves ,False,,sarah.elbaroudy,Sarah Elbaroudy,,,,,,False
7315237056492358954,2023-12-21T21:15:59,14.0,US,,4860.0,510.0,13.0,36200.0,#catsoftiktok #catbaby #cat #kittyking #funnyvideos #cuddlycat #catlife #kittycat #cattok #socute #fyp #foryou ,False,,vvva5054,vvva505,,,,,,False
7313583942735695150,2023-12-17T10:21:12,182.0,US,"silicone color mixing, guess the color, Silicone Mixing, Color mixing, paint mixing, Satisfying Coloring, Coloring, Satisfying Things, paint mixing guess the color, purple",862300.0,4320.0,2902.0,33800000.0,"Relaxing silicone color mixing,purple or sky blue,watch till end to find it,it is so satisfying #satisfying #guessthecolor #coloring #viraltiktok #trendingvideo #fypシ゚viral ",False,,colorstar699,Colorstar699,,,,,,False
7302633269638565162,2023-11-17T22:07:02,60.0,US,"oil change, worst oil change, oil change gone wrong, bad oil change, Used Motor Oil, worst oil change jelly, oil change gone wrong jello, satisfying oil change, oil change goop, oil change but no oil comes out",1100000.0,22900.0,13200.0,20300000.0,Bought a used motor and checked the oil when i got home #hellno #oilchange #blownup ,False,,doubletimebuilds,DoubleTimeBuilds,,,,,,False
7314518073292131627,2023-12-19T22:46:07,36.0,US,"Valley Girl Accent, bun in the oven, Telling My Husband I’m Pregnant, bun in the oven meaning, bun in the oven announcement, Pregnancy Announcement To Family, announcement, Pregnant of TikTok, baby announcement, Pregnancy Reveal",4700000.0,46500.0,22200.0,36300000.0,Replying to @addy❤ Announcing our burnt roll 🤍🤍 #submarinefamily #pregnancyannouncement #milso #miltok #pregnant #pregnancyreveal #husbandwife ,False,,lizroseshort,Liz 🌸,,,,,,False
7310519409339141422,2023-12-09T04:09:49,268.0,US,"sadie reddit story, story teller, sadie sticking out your tongue, home economics teacher reddit story, naturally sadie, whats the creepiest thing you have ever done reddit",601500.0,1055.0,1789.0,6800000.0,#redditstories #reddit #stories ,False,,.syrextales,Syrex the Plug,,,,,,False
7301183421991128363,2023-11-14T00:20:48,60.0,US,,182000.0,1160.0,672.0,7800000.0,Can you guess the rules? #quoridor #boardgame #tabletop #game #tabletopgames #boardgames #fyp #foryou #viral ,False,,itstommylive,Itstommylive • 1.5M,,,,,,False
7301721983807442177,2023-11-15T11:10:36,47.0,AU,,468700.0,52200.0,5068.0,13800000.0,#Volcano in #Iceland erupts. Watch how quickly the situstion escalates. #earthquakes #lava #fyp ,False,,justgeorgeous,Dr George Christos,,,,,,False
7296333427211554090,2023-10-31T23:40:19,160.0,US,"Good Boy Movie, Good Boy, good boy ending, good boy frank, good boy ending scene, frank without his mask good boy, Good Boy Final Scene, good boy scene, good boy 2022, good boy movie explained",1600000.0,10500.0,5448.0,16800000.0,Replying to @Adrian 🧟‍♀️Movie: Good Boy (2022) ⚠️FULL SPOILERS⚠️HORROR #goodboymovie #movie #movierecommendation #horrortok #horrorstory #horrormovie #horrorfilm #scary #fyp ,False,,chronicallyscary,Allie Tran,,,,,,False
7288387199731518762,2023-10-10T13:44:52,63.0,US,,2400000.0,11500.0,3976.0,47000000.0,Im impressed!  ⠀ ⠀ ⠀ ⠀ ⠀ ⠀ ⠀ ⠀ ⠀ ⠀ ⠀ ⠀ #Xyzbca #viral #foryoupage #foryou #trending #fyp #tiktok #fypシ ,False,,ethbnn,ethan,,,,,,False
7034264611809398022,2021-11-24T17:19:18,28.0,US,"disney 100, disney 100 card game, Headspace Meditation, bed",2900000.0,28800.0,77900.0,586300000.0,This is your sign to actually go to bed now. #BePresent @headspace,False,,tiktoktips,TikTok Tips,,,,,,True
7313179217993305390,2023-12-16T08:11:04,90.0,US,"bungalows key largo, all inclusive resorts, All Inclusive Resorts United States, cheap all inclusive resorts, best all inclusive resorts, antigua all inclusive resort, Cancun All Inclusive, St Thomas All Inclusive Resort, aruba all inclusive resort, costa rica all inclusive resorts",488300.0,64600.0,1015.0,7700000.0,Kid free getaways? Say less ✈️ #tiktoktravel #allinclusive #caribbean #allinclusiveresort ,False,,nicolemsunderland,Nicki | Luxury Travel,,,,,,False
7294881399058844958,2023-10-28T01:45:48,93.0,US,,2615.0,5.0,8.0,152200.0,#fyp #redditstories #reddit ,False,,redditpame2,redditpame2,,,,,,False
7311474794241772833,2023-12-11T17:56:34,0.0,GB,,172100.0,14500.0,1280.0,1400000.0,Hmm #fyp #catrizz #cat ,False,,marmiteandtoastie,"Marmite, Toast & Dumpling",,,,,,False
7301747429966171438,2023-11-15T12:49:29,5.0,US,,1200000.0,4170.0,5095.0,14100000.0,Like how???  #fyp #trustinquantavious #foryou #relatable #blowup#fyp  ,False,,quantavious.fickle.iii,AbichaDaGreat🇲🇦,,,,,,False
7314619691589192991,2023-12-20T05:21:15,244.0,US,"firefighter, firefighter training, Ian The Firefighter, Firefighter Rescue Rattlesnake In Nursery Scene, fine firefighter, Firefighter AGT, Giving Donuts To Firefighter, kara lewis firefighter, firefighter pores, Firefighter Students",3300000.0,88900.0,58900.0,94000000.0,Firefighter shows technique that could save a life!,False,,chypdeplo1,chypdeplo1,,,,,,False
7314337329240427808,2023-12-19T11:04:39,67.0,DE,"Wolf Spider, cranberry spiders, cranberry harvest, Cranberry Spiders Picture, cranberry wolf spiders, cranberry farm, cranberries, Spider, Spider Videos, cute spider",539000.0,6105.0,4591.0,10800000.0,Would you do this job? 😳 #job #cranberry ,False,,unique.planet,unique.planet,,,,,,False
7305837315216117034,2023-11-26T13:20:19,16.0,US,"Silver Fish, real life silverfish, What Is Silverfish, real life silverfish new york, Nyc Apartment, nyc, new york apartment, Living In NYC, Living In New York, NYC Roaches Apartment",2200000.0,3979.0,9416.0,38900000.0,yes the gold flake toilet seat came with the apartment #nyc #nycapartment ,False,,dangitdana,dana,,,,,,False
7295926307135819041,2023-10-30T21:20:31,72.0,GB,,1400000.0,1404.0,477.0,30100000.0,#foryou #film #movie ,False,,fypfm99,Shen,,,,,,False
7298078120991788334,2023-11-05T15:30:46,67.0,US,"i understood everything he said car meme, funny memes, Fails Funny Videos, Funny Vídeos, Funny Moments Video, Fail Video, Relatable Funny Videos, Funny Caught On Camera, Pretending My Car Is Their Car, relatable memes",495500.0,1051.0,306.0,5400000.0,Funny Memes 😂 #meme #relatable #funnyvideos #fail #funny #humour #fyp ,False,,specere,Specere,,,,,,False
7313347752543604014,2023-12-16T19:04:37,5.0,US,,34400.0,10400.0,157.0,1100000.0,#fyp #fypシ゚viral #trend #men #women #joke #funny #humor ,False,,mixedlouisianamutt,mixedlouisianamutt,,,,,,False
7305315875207335170,2023-11-25T03:36:44,63.0,JP,,9700000.0,156000.0,135900.0,111800000.0,【極薄トマトきゅうりサンド】🍅🥒🥪🔪 〜Ultra-thin tomato and cucumber sandwich〜 #究極の切れ味 #knifeskills #asmr ,False,,ryota_togishi,研師Ryota,,,,,,False
7303662817297829166,2023-11-20T16:42:16,40.0,US,,2800000.0,199600.0,31400.0,100600000.0,I’m good thanks though 😅 #fyp #explore #rollercoaster #rollercoasters #amusementpark  (@bestdestinationstotravel/IG),False,,whistle,Whistle,,,,,,True
7315144834585529642,2023-12-21T15:18:10,284.0,US,,36800.0,53.0,139.0,594400.0,IG MODEL #minecraftparkour #redditstories #redditreadings #askreddit ,False,,papa.reddit,PapaReddit,,,,,,False
7312083456425495851,2023-12-13T09:18:37,9.0,US,"how to repost tiktok, Repost TikTok, relatable tiktok videos, relatable tiktoks",901100.0,12400.0,32000.0,5100000.0,yall know exactly who you are 😂 #fyp #relateable #funny #1mzach ,False,,1mzach,z@ch,,,,,,False
7314823066733858091,2023-12-20T18:29:32,45.0,US,"jynxzi, so we're in cobblestone, thank you for the happiest year meme guy, black jynxzi, jynxzi reacts, rainbow six siege mobile, singing on the stairs, rainbow, The Rainbow Six Siege, sliding down stairs on feet",1600000.0,29900.0,12700.0,17600000.0,Hype #CapCut #rsinbowsixsiegranked #rainbow6siege #capcut ##rsinbowsixsiegranked #hype #capcut #rainbowsixsiege4everr #rainbow6siege #rainbowsix #rainbowsixsiege #rainbow6siege ,False,,alibi_police,Alibi police,,,,,,False
7305758553128701226,2023-11-26T08:15:06,179.0,PL,,378700.0,3572.0,3266.0,32100000.0,I decided that the silicone strap for the Apple Watch is not beautiful. And I made a genuine leather strap with my own hands #leather #asmr #applewatch ,False,,torross.crafted,torross.crafted,,,,,,False
7310627800069803270,2023-12-09T11:09:39,90.0,TR,"cooking in nature, outdoor cooking, men with a pot, camping, catch and cook, Cooking Video, food tiktok, cooking in wilderness, cooking TikTok, Steak Cooking",11600000.0,121500.0,51600.0,222100000.0,İşveç Kütük Ocakta Doldurulmuş Dana Eti 🥩🏔❄️ #outdor #outdoorcooking #mountains #food #cooking #adventures #cookingadventures #camping #camp #kamp #meatlovers #foodvideos #foodvideo #asmr #outdoors #foodporn #hungr #crunch #relax ,False,,karadenizli.maceraci,KARADENİZLİ MACERACI,,,,,,False
7315333496904404255,2023-12-22T03:30:19,28.0,US,,6.0,0.0,1.0,942.0,Noooooooo #fyp #multiplayer #smallstreamer #lethalcompany ,False,,evieovo,Evie,,,,,,False
7313029157825563950,2023-12-15T22:28:26,87.0,US,"cereal, cereal mukbang, roll for cereal, Restoration Videos, Restoration, Restoration Projects, restoration repair, Cereal Bowl Wall Art, Cereal Grains, Cereal In Freezer",4600000.0,39300.0,23100.0,50700000.0,Replying to @queen_krissy10 Thank you for the idea! What should I restore next? #restoration #restorationprojects #restorationvideos #restorethings #restorationmagic ,False,,restorationmagic,Restoration Magic,,,,,,False
7310533751543581994,2023-12-09T05:05:48,69.0,AU,,499700.0,3901.0,2733.0,11200000.0,Can you do this?! 🤯 Rhythm Challenge Level 5! (EXTREME)  With @amhband  #fyp #foryou #fypシ #viral #challenge #omg #drum #drums #drumlife #rythm #amazing #music #musician #guitar #bass #singer #band,False,,gloss,GLOSS,,,,,,True
7314528924308868395,2023-12-19T23:28:20,5.0,US,,3500000.0,218600.0,37300.0,23300000.0,"Boy was feeling himself.  Not my typocal content, but the world needed to see this. ",False,,mothersewsbest,Amelia Mccall,,,,,,False
7307681349584899370,2023-12-01T12:36:18,0.0,US,,108700.0,260.0,1044.0,914900.0,,False,,redditfrighthours,Reddit Fright Hours,,,,,,False
7310989278119496992,2023-12-10T10:32:24,72.0,IT,,486300.0,4623.0,2532.0,29500000.0,#fy #fypシ゚viral #ice #brr ,False,,eusuntben,eusuntben,,,,,,False
7308832617313340705,2023-12-04T15:03:28,56.0,IT,"7 wonders of world, Colossus Of Rhodes, library of alexandria, Hanging Gardens Of Babylon, why did they remove the 7 wonders of the world, statue of zeus, Seven Wonders Of The World, the library of alexandria, temple of artemis, gardens of babylon",2900000.0,6305.0,8314.0,35900000.0,😳 #fyp #xyzbca #viral #fypシ #foryoupage ,False,,little.curiosity,LittleCuriosity,,,,,,False
7314808888468049184,1969-12-31T19:00:00,,,,,,,,,False,,,,,,,,,False
7315319548989721898,2023-12-22T02:36:13,81,US,,61,1,0,513,We Need a New Black Agent in Valorant #valorant #black #fyp #ph3nom #valorantblack ,False,,ph3nom_,Ph3nom 🉐⚔️,,,,,,False
7297053362237852970,2023-11-02T22:13:58,87,US,"carls jr vs hardee's, Hardees, largest fast food chains, top 30 stores in the us, usa, Fast Foods, big food, American Food, Quick Food, top 50 largest fast food chains",1200000,11200,10300,19100000,Number 1 is surprising 😳🙈🧐 #usa #tiktok #history #fastfood #map #trend #perspective ,False,,populationcentral,Population Central,,,,,,False
7312182142744775968,2023-12-13T15:41:21,71,GB,"Amazon Finds, tiktokmademebuyit, amazon kitchen finds, Kitchen Finds, amazon products, Kitchen Gadgets, Amazon Kitchen, Kitchen Products, Amazon Kitchen Gadgets, kitchen",1200000,41400,4258,16600000,That last one though… 👀 #amazonfinds #tiktokmademebuyit #amazonmusthaves #amazon #coolproducts #kitchen #gadgets #giftideas #homehacks #lifehacks #kitchenhacks #home ,False,,tobesfinds,Tobes Finds,,,,,,False
7313644965278600490,2023-12-17T14:18:03,0,US,,757,14,18,12200,i apologize to the amount of shoes i’ve stepped on or shoulders i’ve crashed into ,False,,lil_peachlee,Livy🤍,,,,,,False
7314020083297275178,2023-12-18T14:33:32,10,US,,164,0,11,2658,this account is slowly becoming active again ,False,,lil_peachlee,Livy🤍,,,,,,False
7314443628057791790,2023-12-19T17:57:16,10,US,,180,0,14,2979,i have handwriting dysmorphia ,False,,lil_peachlee,Livy🤍,,,,,,False
7314909401255693614,2023-12-21T00:04:36,0,US,"suburb talks, brain chemistry, christine suburb talks leaves, That Altered My Brain",241900,448,645,1000000,suburb talks has altered my brain chemistry ,False,,lil_peachlee,Livy🤍,,,,,,False
7304819988441861381,2023-11-23T19:32:24,68,CA,,858900,23100,19900,36100000,Customer stated that they were having some drainage  issues… wonder why 🤷‍♂️.        #plumbingpros  #construction #dirtyjob #foryou #fyp #plumbing #goodtimes ,False,,castandbrassplumbing,castandbrassplumbing,,,,,,False
7307270976658558251,2023-11-30T10:03:53,122,US,,74300,917,1273,2100000,The SAT Question Everyone Got Wrong #veritasium #veritasiumcontest #SAT #physical #circle ,False,,veritaxium911,No Name,,,,,,False
7306289938532748586,2023-11-27T18:36:44,215,US,,67900,547,413,2900000,#oddlysatisfying #cleantok #ruglove🫶 #carpettok #decompress #relax #trend #rugbesties #foryoupage #asmrsounds #viral #rug #carpetcleaning #new #fyp #rugtok #cleaning #tiktok #rugasmr #rugscraping #fypシ #rugwashing #soothing #relax #relaxing #asmr  📹: Lubuskie Cleaning Center YT ,False,,asmrdailyfix,ASMRDailyFix,,,,,,False
7305187924230835486,2023-11-24T19:20:17,58,US,,2600000,26100,14600,19800000,Mom confronted me for taking her daughter shoes when she didn’t have money for her nails. #559fresno #nails #nailsoftheday #nailtech #tutorial #trendingnails #fyp #foryoupage #nail #559nails #gelpolish #nailtok ,False,,thethailyfe,The Thai Lyfe,,,,,,False
7311888686440910110,2023-12-12T20:42:38,98,US,,224100,3201,1483,3600000,#tiktok #fyp #amazingworld #omg #ocean #puffer ,False,,lifeoflanimals606,lifeoflanimals606,,,,,,False
7293478250108521761,2023-10-24T07:00:40,146,GB,,117600,217,374,2100000,Saul was too cold always a trick up his sleeve… #bettercallsaul #bettercallsaulreaction #breakingbad #saulgoodman #roadmanreacts #plottwist #chuckmcgill ,False,,criimzonx,Crimzon,,,,,,False
7296135515298925856,2023-10-31T10:52:14,68,GB,,1000000,8448,2369,16100000,The most disrespectful kill in COD history 😂 #CallofDuty #COD #Warzone ,False,,topcallofdutyplaysyt,TopCallofDutyPlays,,,,,,False
