video_id,video_timestamp,video_duration,video_locationcreated,suggested_words,video_diggcount,video_sharecount,video_commentcount,video_playcount,video_description,video_is_ad,video_stickers,author_username,author_name,author_followercount,author_followingcount,author_heartcount,author_videocount,author_diggcount,author_verified
7304900246071479558,2023-11-24T00:43:50,16,CA,"cat meowing, Red Panda, Meowing Cat Sound, british shorthair cat, dwarf cat, munchkin cat, yeti the cat, Cat Sound Attracts Cat, Cute Cats, cat sounds",7300000,153700,28900,32800000,Coco does not appreciate it when i change the bedsheets at all…….,False,,coco_bear_world,coco’s world 🍉,,,,,,False
7312240813843467550,2023-12-13T19:29:08,7,US,"lethal company, lethal company bug, that one bug in lethal company, lethal company loot bug, loot bug, Deep Rock Galactic, lethal company hoarder bug, lethal company funny moments, Deep Rock, yippee lethal company",297100,23600,1435,1700000,#lethalcompany #lootbug #deeprockgalactic #funny #funnyvideos #fyp,False,,klappasclips,TheKlappa,,,,,,False
7308083698790862112,2023-12-02T14:37:16,13,CH,"pizza skiing, skiing, south park skiing, pizza skiing south park, pizza french fry ski, pizza skiing meaning, do a pizza skiing, south park pizza and french fry, How To Ski, ski fails",1800000,68200,15300,26500000,#ski #pizza #skifun #skifun😍😍 #skifunny #skipizza ,False,,vinniwhy,Entertainment4U🍿,,,,,,False
7309283072174820651,2023-12-05T20:11:37,6,US,"Pet Rat, Mouse Pet, Funny Animal Videos, funny video, Funny Animal, Animal Memes, funny memes, funny tiktok videos, Funny Pet, Funny Pet Videos",4200000,88300,18500,24000000,#funny #memes #funnyvideos ,False,,doseofmemez,Dose Of Memez,,,,,,False
7311629066707143941,2023-12-12T03:55:05,22,PH,"cookies, Cookies Recipes, woop woop, How To Make Cookies, christmas cookies, chocolate chips cookies, Peanut Butter Cookies, Oatmeal Cookies, Making Cookies, Homemade Cookies",17000000,648100,128700,112100000,Cookie Wop Wop 🤣 #fyp #fypシ #foryou #wopchallenge #cookies #dance #foodie #baked_ish ,False,,bakedish,BakedIsh,,,,,,False
7307670528834243873,2023-12-01T11:54:01,13,GB,"horrible band concert, clarinet, clarinet concert, band concert, middle school band, horrible orchestra concert, elementary school band, Clarinet Solo, clarinet concert kids, horrible band concert school",2300000,109900,16100,18300000,I feel like i should have a blue peter badge for holding it together. My sons clarinet school concert esrlier. Weve all got to start somewhere ey  #myson #music #concert,False,,neil_r80,Neil,,,,,,False
7310170169974803745,2023-12-08T05:33:54,16,IT,"we are the exception, todo and yuji vs mahito, todo, 120 percent jjk, todo edit, Todo Physique, todo and yuji, todo entrance shibuya, todo we are the exception, yuji itadori",271800,11000,1894,1400000,Always the pregnant woman #jujutsukaisen #jjk #meme #todo #yuji #joke #2v1 #bro #fyp #fypシ ,False,,damncaty,Catello🫧⚓,,,,,,False
7311436161862602030,2023-12-11T15:26:47,16,US,"submerged filter, Water Filter, i am under the water, grinch, Filters On TikTok, water effect filter, under water filter, submerged filter prank, Aging Filter, water",2400000,15200,6922,71500000,Filters shpuld not be allowed to be this realistic ,False,,itsaustinlincoln,Austin Lincoln,,,,,,False
7312448488711802154,2023-12-14T08:55:02,13,US,"CapCut, take your last video in your camera roll, capcut tiktok video, Capcut Video, capcut video template, cooking videos, Cap Cut Template, capcut templates for videos, CapCut Video Edit, Cooking Tiktok Videos",454200,320,738,9100000,#CapCut this template tough😮‍💨#fup #lethimcook ,False,,ky.allen5,Ky Allen,,,,,,False
7310283046278761761,2023-12-08T12:51:54,12,GB,"tenz flick on breeze, tenz flick, Valorant, tenz flick on breeze reaction, redux valorant raze op flick, tenz flick on prx, fallen valorant, demon 1 valorant, tenz and kyedae, tenz flick on haven",335500,4034,1107,4100000,Sickest clip of all time in VCT? #Valorant #valorantclips #gaming #Raze,False,,clipzval,Valorant Aces !,,,,,,False
7310497508755606816,2023-12-09T02:44:17,12,GB,"my next date filter, my next date, Garlic Fries, date filter, TikTok Effects Filter, trending filters effects, turning with the filter, filters on tiktok, This Or That Date, Funny Faces Filter",988100,7530,3690,11500000,,False,,mardy_moore,Mardy Moore,,,,,,False
7312487630359235886,2023-12-14T11:26:50,69,US,"spongebob funny moments, shut your mouth you mediocre spongebob, spongebob dime scene, spongebob, spongebob episodes, spongebob dime scene in german, german spongebob, i'm ready i'm ready no you ain't, not until 4, funny spongebob scenes",2100000,11200,4456,11800000,#fyp #spongebobsquarepants #funnyvideos  #nickolodeon #patrick  #viral #makethisgoviral ,False,,octivia43,NickWild,,,,,,False
7309501993645509889,2023-12-06T10:20:59,7,MY,"funny cats, wii play tanks, Funny Cat Videos, wii tanks, cat noise attracts cats, wii tanks theme, Cat Videos, cat meowing, isuperpet, funny animals videos",3800000,529400,47300,59900000,Cat in the tank #funnycat ,False,,isuperpet,iSuperPET,,,,,,False
7312165049957666080,2023-12-13T14:35:01,8,DE,"Vet Cats, Cat Of Tiktok, Cattok, cat running, Cats Funny, Cat Chattering, cat meowing, Cats Hissing, cat talking, the cat in the bag",619700,16300,946,5600000,That wasn‘t the plan #vet #meme #cat ,False,,thecannedmemes,Canned Memes,,,,,,False
7309996709050961195,2023-12-07T18:20:47,59,US,,47800,1074,300,4000000,For the one you love #christmasgift ,True,,seasonal.picks,Seasonal Picks,,,,,,False
7307573552532802848,2023-12-01T05:37:42,18,DE,"what's a soulmate, soulmate, CapCut, soulmates filter, whos my soulmate filter, heart, Soulmate Filter Effects, Soulmate Filter Letter, soulmate ring filter effect, capcut video template",348700,18900,1229,15200000,#CapCut #soulmate #love #heart #fyp #tenplate #whatsasoulmat ,False,,okamana777,Okamana,,,,,,False
7311106316267834629,2023-12-10T18:06:33,24,CA,"boss baby ricky, baby ricky, ricky young and rich, international student rizz, young and rich, ricky rich and handsome, international student, ricky rizz, young and rich tall and handsome, international rizz",813500,16700,4562,6100000,Why did baby ricky rizz not work :( #asian #asiandating #mandarizz #internationalstudent #ricky #asiangirl #chinese ,False,,remyzeee,Remy Zee,,,,,,False
7311863178131000619,2023-12-12T19:03:39,105,US,"ulta christmas caroling, christmas caroling, memphis christmas caroling, singing ghetto christmas carols, christmas carols in the hood, sean odigie, singing christmas carols, scaring people prank, a ghetto christmas carol, Christmas Song",814300,106100,10300,4900000,"rest on youtube: Sean Odigie video called Singing Ghetto Christmas Carols Prank! 2"" #foryoupage #fyp #christmascarol #memphis #seanodigie",False,,notseanodigie,Sean Odigie,,,,,,False
7312243265623903531,2023-12-13T19:38:40,12,US,"evolution of the tallest building, giant building, Office Space Promotion Scene, world trade center however",242200,14200,1195,2300000,Replying to @Rootbeer🍺 ,False,,696_daytona,696_Daytona,,,,,,False
7302888114555538731,2023-11-18T14:35:58,0,US,"shirts for every major, My Collection, Environmental Science, Tshirt Collection, Shoes Collection, Mechanical Engineering Major, Biology Major, Criminal Justice Major",110500,1840,1039,941500,This has been a fun collection to make :),False,,brys.online,Bryson,,,,,,False
7311431122817174830,2023-12-11T15:07:09,31,US,"the design is very human, Engineering, Electrical Engineering, Engineering Design, Arduino Projects, Engineering Buildings, Electrical Plugs, Electrical Installation, Electrical Outlet, Engineering Jobs",386700,19000,1801,3100000,The design is very human 👍 #electronics #arduino #engineering #funny ,False,,placitech,PLACITECH,,,,,,False
7296948171002088750,2023-11-02T15:26:04,32,US,"disney 100, frog, Disney, frog in my hand, disney 100 card game, Cute Frogs, I Have A Frog In My Hand, Frogs Videos, Frog Swim, Giant Frog",5800000,246100,46100,37000000,,False,,notchrisinmiami,notchrisinmiami,,,,,,False
7311936714392603936,2023-12-12T23:49:08,64,GB,"andre braugher, Brooklyn 99, andy samberg reaction to andre, Andy Samberg, captain holt, andre braugher cast reaction, how did andre braugher pass, andre braugher edit, captain holt edit, brooklyn 99 final scene",2700000,49600,17300,12300000,"Rest in peace Andre Braugher, you will always be remembered 🕊️ #andrebraugher #andrebraugheredit #brooklyn99 #captainholt #captainholtedit #captainholtb99 ",False,,fandcmfiguress,fandcmfigures,,,,,,False
7312117998314147114,2023-12-13T11:32:35,80,US,"brooklyn 99, andre braugher, how did andre braugher pass, Brooklyn Nine-Nine, andre braugher andy samberg, Brooklyn Nine-Nine (2013), andre braugher andy samberg it was perfect, andre braugher suite life, how did andre braugher pass cancer, cheddar brooklyn 99",50000,1803,767,1700000,"Andre Braugher, star of 'Brooklyn Nine-Nine' and 'Homicide: Life On The Street,' died at age 61. #cnn #brooklyn99",False,,cnn,CNN,,,,,,True
7299585784376577322,2023-11-09T17:01:13,67,US,"notes app trend, notes app, when you check your gf notes app, Digital Note Taking, girls notes, Notability App, Writing Notes, a woman's notes app, notes app list, list of names in notes",1400000,37200,4984,9900000,at least shes thinkin ahead hahaha,False,,zachirific,zachirific,,,,,,False
7299585784376577322,2023-11-09T17:01:13,67,US,"notes app trend, notes app, when you check your gf notes app, Digital Note Taking, girls notes, Notability App, Writing Notes, a woman's notes app, notes app list, list of names in notes",1400000,37200,4984,9900000,at least shes thinkin ahead hahaha,False,,zachirific,zachirific,,,,,,False
7311219554410089774,2023-12-11T01:26:23,8,US,"jenn melon, League of Legends, jenn melon league of legends, league of legends meme, Lol League Of Legends, Jinx (Character) - League Of Legends, Sock, Jinx League Of Legends, Briar League Of Legends, victor league of legends",735200,25900,1565,4800000,if they’re are any spirits here take them socks off #comedy #meme #viral #leaugeoflegends,False,,_jennmelon_,Jenn Melon,,,,,,False
7308180065072909614,2023-12-02T20:51:22,90,US,"everyday bro jake paul, Blind Date, its everyday bro, blind date show, blind dating 8 guys based on outfits, Acting Videos, acting, Acting TikTok, Acting Scenes From Movies, Acting Scenes",1000000,3546,1878,11800000,#pov #foryou #acting #tiktok #viral #skit #fyp ,False,,rui397gisb,rui397gisb,,,,,,False
7309551583333829931,2023-12-06T13:33:30,106,US,,297500,318,1459,4600000,Part 1 | #reddit #storytime #fyp ,False,,redditloo,Reddit Stories,,,,,,False
7309525081586191621,2023-12-06T11:50:32,6,BY,,748200,1680,9900,32000000,Crazy Parking 7 #crazyparking #fyp #wayudance #filter #musicfyp #fy ,False,,prod.wayudance,prod.wayudance,,,,,,False
7310348190866361643,2023-12-08T17:04:55,153,US,"digital photo frame, digital picture frame deal 2023, bsimb digital picture frame, picture frame digital, tiktokshop, christmas gift ideas, frameo digital frame, digital frame, tiktok shop online store, bsimbframes",59900,6991,817,8500000,"Not just for grandparents! As a millenial I dont print photos, so this digital frame comes in clutch. @BSIMBFRAMES #christmasgift #giftidea #tiktokshop #tiktokshopgifts #grandparentgifts #digitalphotoframe #tiktokshopholidaydeals ",True,,mikesdealfinder,Mikes Deal Finder,,,,,,False
7310303946298379566,2023-12-08T14:13:11,10,US,,575800,2173,4226,5200000,#fyp #fondo #eminem ,False,,itsnotrobby,Robby OT,,,,,,False
7309558058932391199,2023-12-06T13:58:40,18,US,"The Rumbling, penguins, Animal, Zoo Animal, Pittsburgh Zoo, Pittsburgh Penguins, zoo, Animal Videos, animals of tiktok, Penguins Of TikTok",156500,14100,618,1300000,I can't wait to be a penguin marshall this weekend for the #pittsburgh #zoo Most mischievous 65$ ever spent. #meme #news #attackontitan #animals ,False,,skulliollie,Skulli Ollie,,,,,,False
7308905337313185031,2023-12-04T19:45:43,14,AU,,4415,8,14,72700,Life. ,False,,d3kchung,D3kchung,,,,,,False
7311457852357512494,2023-12-11T16:50:48,61,US,,762,2,8,20100,"Cacturne is in fact, not chill like that🌵 #pokemon #top5 #pokedex #pokedexentry #creepy ",False,,fearlessskee,FearlessSkee,,,,,,False
7311400116835978539,2023-12-11T13:06:58,459,US,"scary reddit story, divorce, Divorce Lawyer, Storytelling, Lawyer, marriage story, muslim reddit",419300,1699,3274,4500000,My LYING WIFE had a MULTIPLE YEAR long AFFAIR and the lawyer told me I would LOSE EVERYTHING if I DIVORCED HER. So I spent YEARS perfecting my PAYBACK. #redditstories #reddit #redditstorytimes #redditreadings #askreddit #redditfeeds This story may be adapted for more entertainment.,False,,redditfeeds,Reddit Videos,,,,,,False
7308122484455378208,2023-12-02T17:07:50,0,DE,"Chicken tikka masala, korean fried chicken, chicken katsu, Chicken Alfredo Pasta, orange chicken, Fried Chicken, butter chicken, teriyaki chicken, chicken noodle soup, chicken wings",2600000,44600,30100,15500000,sorry for the vegetarians 😭 #chicken #chickenfood #food ,False,,fodvids,︎,,,,,,False
7310727490115341611,2023-12-09T17:36:47,0,US,,63600,2744,351,506800,How will they buy things in bulk??,False,,fatfatpankocat,Panko Cat,,,,,,False
7309367188236848426,2023-12-06T01:37:54,21,US,,269500,15100,1560,1600000,oil painting#drawing,False,,69fcgr,69fcgr,,,,,,False
7310594082487799082,2023-12-09T08:59:18,16,US,,339300,692,14200,12300000,Hahahaha you cant 😂🫵 #viralvideo #fyp #zxybca #tesla #car #road #street #ramp #jump #worldrecord #highscore ,False,,warmcreator,WarmCreator,,,,,,False
7311436138974088491,2023-12-11T15:26:32,7,US,,23,0,0,1799,Im good 👍🏼 thanks though,False,,delane.hb,Delane.hb,,,,,,False
7309193943525248289,2023-12-05T14:25:37,13,NL,"christmas games, elves on the shelf ideas, Christmas Gift Ideas, christmas, take your last video in your camera roll, christmas cookies, little red truck christmas tree, christmas wish list, family christmas games, christmas sounds",2000000,3341,3013,48000000,❄️🔛🔝,False,,littlefynnie,🩶,,,,,,False
7309598752766020895,2023-12-06T16:36:41,0,US,,564600,39300,9570,3800000,gato buscando comida 🐱,False,,cristofermartinez051,meme,,,,,,False
7308794481011100974,2023-12-11T18:05:00,75,US,,0,0,0,170,i’m assuming this means i still don’t pass the kathrynfiona  — verge article out now #turingtest,False,,user4677220201261,user4677220201261,,,,,,False
7309246492353514794,2023-12-05T17:49:37,10,US,,21800,293,136,434700,Would you rock this? Let me know in the comments. #jjk #jujutsukaisen #jjkseason2 #gojousatoru #getosuguru ,False,,aniwearclothing,AniWear,,,,,,False
7311252180768427307,2023-12-11T13:00:00,88,US,,109,0,0,2370,I Made Earth Bigger Than the Sun and This Happened - Universe Sandbox#graystillplays   #animation    #animationmeme    #fyp   #fypシ゚viral     #viraltiktok  #cartoon  #nanimation  #animationmeme  #foryourpage  #fortnite  #funny  #funnyvideos  #fytiktok  #povstories  #usa    #viral_video  #povs   #trendingsong  #trendingvideo  #trendingtiktok  #viralvideo  #tiktok  #foryoupageofficiall  #trendingsong,False,,graystillplays.usa,GrayStillPlays,,,,,,False
7311464966844943658,2023-12-11T17:18:25,114,US,,44800,363,194,317800,Crowd work for smart people #religion #religioushumor #christianity #catholic #episcopal #catholocism #comedy #standup #crowdwork #standupcomedy #humor #lol #funny #funnyvideos ,False,,geoffreyatm,Geoffrey Asmus,,,,,,False
7311386310634245409,2023-12-11T12:13:07,60,GB,,103900,316,1510,5000000,Crazy Parking 11 #crazyparking #crazyparking11 #filterchallenge #crazyparking11filter #fazesway #fypage ,False,,calboltonnn,calboltonnn,,,,,,False
7304820776945847594,2023-11-23T19:35:39,10,US,"Mount Everest, you know that song like mount everest, mount everest ain't got shi on me transition, CapCut, mountain everest ain't got on me, mount everest ain't got shi on me edit, mount everest ain't got nothing on me, mt everest ain't got, mount everest bodies, i'm on top of the world",727700,1784,1434,16300000,Finding random #CapCut templates ,False,,user537586295,✝️Real💟,,,,,,False
7311361363090197766,2023-12-11T10:36:16,6,BY,"car parking filter, car parking, car parking level 9, car filter game, cars filter, exit filter game, Face Effects Filter, crazy parking 40, Addicting Game Filter, parking car filter 1002",665900,2176,5050,35200000,song: wayudance – Plug #filter #fyp #crazyparking #wayudance #viral ,False,,wayudance,wayudance,,,,,,False
7311187350812364065,2023-12-10T23:21:57,27,US,water as chaser,1500000,36200,4079,17900000,The End 🤣🤣 #funny #funnyvideos #animals #dog #cat #pet #viarl #foryou #fyp (860),False,,minegreen.us,minegreen.minecracft,,,,,,False
7302915218194140459,2023-11-18T16:21:09,30,US,"taylor swift 2024 calendar, Taylor Swift, Christmas Gift Ideas, white elephant gifts, christmas games, christmas decor 2023, Christmas List 2023, travis kelce taylor swift, taylor swift gifts, Christmas Tree",657900,31900,2977,23400000,The PERFECT gift for Taylor Swift fans ✨ #christmas #giftguide #gift #gifts #giftideas #giftsforher #giftsforhim #christmasgift #christmasgifts #christmasgiftideas #fyp #foryou #foryoupage #christmas2023 #christmascountdown #christmastok #giftsformom #giftsfordad #taylorswift #taylorswiftcalendar #taylorswiftgift #swifttok #taylormerch #swiftiemerch #swiftie ,False,,mrsmckennabarry,McKenna Barry,,,,,,False
7311128680296762655,2023-12-10T19:33:32,25,US,"whats your wechat, international rizz, justin han, rizz, chinese rizz, justin han girlfriend, international student rizz, Rizz Pickup Lines, we chat, Super Shy",1900000,40300,27500,11000000,We just rizzed all over your face @Remy Zee #chinese #korean #international ,False,,justinhansome,Justin Han,,,,,,False
7311071234224049414,2023-12-10T15:50:26,5,CA,,165100,2346,974,759800,Im so clumbsy 🤦‍♂️ #fyp #minecraft ,False,,basic_frog22,Jordan🐸,,,,,,False
7306895761479077153,2023-11-29T09:47:33,68,LB,,245100,437,110,2900000,This was insanee 😳 #fyp #foryou #foryoupage #gta5 #funny #humor ,False,,podcast.clips224,Podcast.clips224,,,,,,False
7311207548047133982,2023-12-11T00:39:42,18,US,"danny devito chess, Danny Devito, always sunny in philadelphia chess game, always sunny chess scene, hans neiman beads, morse code, finals week college, Chess, college, chess game",886100,32700,5462,4500000,Never back down never what #funals #finalsweek #college ,False,,illiteratepickle,︎ ︎ ︎ ︎ ︎ ︎,,,,,,False
7302114507478846752,2023-11-16T12:33:46,6,GB,,167200,5693,2355,1500000,Public transportation 😍 #tfl ,False,,36scoops,36scoops,,,,,,False
7304276291182775584,2023-11-22T08:22:39,15,IT,"CapCut, me obsessed with you, me in love with you yes i am, me in love with you, Capcut Edit, cap cut templates, capcut templates that hit hard, capcut templates for videos, me obsessed with you no tf i'm not, birthday capcut templates",858100,9783,1938,21300000,#CapCut #templatecapcut #CapCutAmor ,False,,cap.cut_for.you,🚀CapCut🚀,,,,,,False
7310238992648391982,2023-12-10T17:05:00,9,US,,709,1,0,5979,🤭 #chaewon,False,,_yejimunchinn_,lsrfm’s enthusiast,,,,,,False
7308532485703355694,2023-12-03T19:38:53,23,US,"how to play black jack, black jack strategy, 32 games of blackjack, card games, Meme Card Game, poker face, Winning Bar Spin Game, 32 black jack, most blackjack hands won in a row, fast money game",435700,21200,3241,2600000,Tag a Gambler friend #gambler #gambletok #poker #meme ,False,,mapuch2,Matchu,,,,,,False
7308845017626348842,2023-12-04T15:51:49,21,US,"he he he haw, Clash Royale, clash royale he he he ha, he he he haw meme, clash royale emote, learned a lot in class today, clash royale voice actor, clash royale sound, clash royale class, clash royale he he he ha irl",1800000,37300,8585,15000000,#clashroyale #fypシ゚viral ,False,,bralimlim,bralimlim,,,,,,False
7291260141763087662,2023-10-18T07:33:25,80,US,,503700,15100,4196,3300000,The Happy World of Lemurs.#lemur #happy #centipede #ainmalword #wildanimals ,False,,smallanimal778,smallanimal,,,,,,False
7308395853901843744,2023-12-03T10:48:38,162,US,,326000,304,498,5000000,Part 1 #storytime #fyp #reddit #redditstories #foryou #foryoupage #viral #usa🇺🇸,False,,maya094_1,Maya,,,,,,False
7290856518902123808,2023-10-17T05:27:04,29,GB,"mercury go home update, mercury go home, mercury go home original, willow the cat, cat videos, Cats Of TikTok, Cattok, funny cat, Cat TikTok, cat funny videos",3100000,282300,68100,30600000,Mercury has spoken. #cat #catsoftiktok #cattok #fyp #funny -#funnyvideos #PetsOfTikTok  Https:shop.tiktok.com/view/product/172940171383777?region=GB&locale=en-GB,False,,fetching_freya_and_rollo,Fetching Fun Furry Stuff,,,,,,False
7310998923387145504,2023-12-10T11:09:51,146,GB,,721300,20200,1757,5200000,#comedy #funnymoments #fyp #funnyvideos ,False,,commedy_lol,Anatole,,,,,,False
7310739682453785902,2023-12-09T18:24:00,13,US,"christmas parade accident 2023 bakersfield, christmas, christmas parade accident 2023, christmas parade accident, christmas parade 2023, christmas parade, CapCut, Parade, take your last video in your camera roll, Parade In The Sky",682100,616,1685,10600000,#CapCut bro I had so much fun at the parade😊 #foryoupage #fypシ #lastvideo ,False,,they_luvvivisss,˙✧˖° 𝒱𝒾𝓋𝒾⋆｡˚꩜,,,,,,False
7311043681191021854,2023-12-10T14:03:41,0,US,"word hunt, word hunt techniques, how to win at word hunt, game pigeon, longest word hunt game, longest word hunt word, how to get better at word hunt, word hunt strategy, how to be good at word hunt, word hunt world record",1700000,32600,13300,9100000,The longer word ever found in word hunt??? 🤔🔥💪 #fypシ #TikTokHolidays #gamepigeon #wordhunt #imessagepool #viral #tyrone #dictonary #darts ,False,,wordgamesgoat,wordgamesgoat,,,,,,False
7309254575154941230,2023-12-05T18:21:03,90,US,"Spain, Spain Vacation, Trip Travel, Crush Relatable TikTok, Travel Vacation Trip, Ibiza Spain, Malaga Spain, Study Abroad",396700,7747,1565,2900000,,False,,zachirific,zachirific,,,,,,False
7295761499904331013,2023-10-30T10:40:50,18,CA,,887000,15300,2667,4700000,Another great day of saving the bees 🐝😹 #halloween2023 #cat #kitten #savethebees #catsoftiktok ib @Vixbull Frenchies ,False,,diaryofollie,Ollie the Cat,,,,,,False
7310019334095604993,2023-12-07T19:48:37,9,DE,"The Bear, My Life with the Walter Boys, The Bear Edit, the bear costume, The Bear 2022, movietok, Movie Suggestions, Phone Booth Movie, The Polar Bear, movie recommendation",2200000,33000,15100,9900000,,False,,dolarstoretrash,Wahidou,,,,,,False
7310646791341477163,2023-12-09T12:23:30,9,US,"long distance relationship, long distance, Long Distance Relationship Struggles, Long Distance Reunion, whose most likely to bf and gf, goldenretriever boyfriend",517200,29500,1596,3600000,im so dramatic fr ,False,,mynameisntmanny,Manny Pardo🧸🪩💋✨,,,,,,False
7308484239006256416,2023-12-03T16:31:36,13,GB,"CapCut, What Makes You Happy?, oh i love and i hate it, daylight, daylight david kushner, running from the daylight, from the daylight, happy birthday capcut template, Happy Birthday Capcut, birthday template capcut",2000000,12800,14900,36900000,what makes you happy? #friends #love #childhood #CapCut #relatable #happy ,False,,trendingcapcuttemplates,Trending CapCut Templates,,,,,,False
7293177915246660896,2023-10-23T11:35:13,124,US,,777500,15800,1029,4600000,Funny Cats 😂😂 episode 13 #cat #catsoftiktok #cats #funny #funny #pet #animals #catfail #🤣🤣🤣 #fyp #foryou #haha ,False,,funny.petcat,Funny Pet 😺😺,,,,,,False
7284362378886663466,2023-09-29T17:26:40,64,US,"funny cat videos, Funny Cats, Cat Meowing, Cat Videos, funny animal videos, funny animal, Meowing Cat Sound, Cat Screaming, cat talking, Cute Cats",7500000,500600,18100,35600000,Part 2 | Funny cat videos #funnycats #funnyanimals #funnypets ,False,,funnycats0ftiktok,FunnyCatsofTiktok,,,,,,False
7297246118641978657,2023-11-03T10:41:56,124,US,,592200,19000,1773,6200000,The last one 😂 episode 194 #funny #pet #animals #funnyanimals #fyp #funnycats #funnypets #foryou #cutecats #🤣🤣🤣 ,False,,funnyanimalkbz,Funny Animal 😽😽,,,,,,False
7290941404438629665,2023-10-17T10:56:24,197,GR,,364500,2072,453,3000000,Is anybody else’s favorite character Chandler?? #friends #friendstvshow #chandlerbing #funny #fyp ,False,,friendsmp4_,Friends.mp4,,,,,,False
7280935708674624811,2023-09-20T11:49:18,61,US,"funny cat, Cute Cat Videos, cutecat, funny animal, Cat Meowing, cat funny videos, kittens imitating, cat videos, Cats Of Tiktok, Kittens Of TikTok",4800000,395200,17900,53500000,How well can kittens imitate🥰🥰#cat #cats #catlover #foryou #fyp ,False,,catplanet6,Cat Planet,,,,,,False
7289147621636132139,2023-10-12T14:55:57,67,US,"Renata Bliss, freestyle dance teacher, give me your frickin money, give me your f money, vine compilation, nostalgia videos, nostalgia, Vines Throwback, childhood nostalgia, Nostalgia Moments",418800,11100,959,4500000,Never forget #vine #vines #nostalgia #classicvines ,False,,classicvines123,ClassicVines,,,,,,False
7283131343158971680,2023-09-26T09:49:26,63,FR,,498900,22200,870,5800000,#funnycats #funnydogs #petsfunnyvideos #pet #kitty #cutecats #funnypets #catvideos #funnytiktokvideos ,False,,funny.animals826,funny animals,,,,,,False
7295080333953748267,2023-10-28T14:37:44,61,US,"she was a fairy, Funny Cat Videos, funny cats, orange cat activities, Orange Cat Behavior, orange cat, funny animal videos, cat videos, Cat Swimming, funny animal",5900000,219100,23700,48700000,Part 14 | Funny cat videos #funnycats #funnyanimals #funnypets,False,,funnycats0ftiktok,FunnyCatsofTiktok,,,,,,False
7281259209059028256,2023-09-21T08:44:33,109,FR,,249400,12300,340,3500000,The end#fail #funny #dog #pet #funnyvideo #haha #wee #faimlyfirst #foryou ,False,,funny_animals630,funny,,,,,,False
