video_id,video_timestamp,video_duration,video_locationcreated,suggested_words,video_diggcount,video_sharecount,video_commentcount,video_playcount,video_description,video_is_ad,video_stickers,author_username,author_name,author_followercount,author_followingcount,author_heartcount,author_videocount,author_diggcount,author_verified
7302159099028868357,2023-11-16T15:26:46,10,CA,"bojack horseman, bojack horseman quotes, shaving cream guy, rehab was supposed a fresh start, was it worth it to be happy bojack, shaving cream trend, bojack, reese's commercial bojack, bojack sad quotes, bojack horseman audio",3100000,132100,17300,17200000,Deep in thought✍️✍️,False,,meagan.nichols,Meagan,,,,,,False
7314611460154461482,2023-12-20T04:49:15,0,US,,179,2,0,8885,what was the most legendary meltdown you witnessed? #reddit #fyp #askreddit #work #meltdown ,False,,thonkthreads,thonkthreads,,,,,,False
7313678446964624686,2023-12-17T16:27:50,61,US,"cat distribution system, brandon robert, brandon robert rado, Mainecoon Cat, brandon robert annoying, brandon robert controversy, cat meowing, The Cat Distribution System, ragdoll cat, Cattok",12200000,232700,44100,109300000,I didnt have my glasses on😭😭 #cat #catsoftiktok ,False,,thebrandonrobert,Brandon Robert,,,,,,True
7312557785470733600,2023-12-14T15:59:01,59,NL,,1600000,37400,3885,12900000,Orange Cat Activities 😹,False,,cats__of__the__internet,cats__of__the__internet,,,,,,False
7311812975646575905,2023-12-12T15:48:46,61,GB,,2600000,51300,7521,10600000,#catsoftiktok #catmemes ,False,,catdraven0,catdraven0,,,,,,False
7310756509879668011,2023-12-09T19:29:16,38,US,,236000,5413,709,2700000,My 25 lb cat can fit in there too  #cattunnel #catsoftiktok #cats #tiktokshop #cattoys #reggie #felix #crazy #zoomies ,False,,martharoseyy,Martha Rosey,,,,,,False
7309118099301715243,2023-12-05T09:31:25,38,US,,89200,622,564,476300,Thanky you Hanni from @NewJeans for covering my song once in a moon 🌙 #hanni #newjeans #originalsong ,False,,sarahkangmusic,sarah kang,,,,,,False
7314016440552803630,2023-12-18T14:19:25,19,US,"Gandalf The Cat, sun chips, Cat Eat Vegetables, cat videos for my cat, Wisp The Cat, Chips, Sun Chips Review, Chips Snacks, Cat Sound To Attract Cats",427000,18200,2097,2500000,sun chip ,False,,sorryimpat,Sorryimpat,,,,,,False
7309196916351487278,2023-12-05T14:37:29,28,US,"Steve Harvey Funny Moments, steve harvey, Family Feud, family feud funny moments, funny family feud, family feud sits on it, name something steve harvey, steve harvey family feud, celebrity family feud, steve harvey omega psi phi",1600000,60900,4052,14100000,What part of her body does a woman use to control her man?? 🤔🦵👀 #SteveHarvey: “You don’t know what to do!” #FamilyFeud,False,,familyfeud,Family Feud,,,,,,True
7313353135911669024,2023-12-16T19:25:31,0,GB,"Relatable Lyrics, Lyrics Video, Red Thoughts Song By YG Tesh, lyrics, relatable tiktoks, love",237100,13900,5819,1500000,#redthought #fypシ #fy #him #fypシ゚viral #foryoupage #foryoupsge #foryoupage❤️❤️ #fyppppppppppppppppppppppp #blowup #slideshow #viral #redthoughts #us? #ly #lyrics #red #love #teenagers #relatable ,False,,red.th0ughts888,rëď ťħøũġħťş,,,,,,False
7298736459886906642,2023-11-07T10:05:11,23,AU,"now you won't let go, which bedroom you choosing, which bed you sleeping in, Where Are You Sleeping The Hardest, which bedroom are you cuddling the hardest in, now you won't let go song, which room are you sleeping in, choose your bedroom, enteryournewreality, pick which bedroom",963100,44300,25100,9400000,Which bedroom would you spend the night in? 😴  #chooseone #relaxingvideo#whichonewouldyoupick #relaxingvideos  #foryou #fyp  . . . Which bedroom would you choose Which bedroom you choosing Which bedroom you sleeping in Which bedroom would your gf choose Which bedroom would u pick Which bedroom aesthetic Which bedroom would you sleep in Choose your bedroom Choose your bedroom vibes Where are you napping Where are you napping hardest,False,,enteryournewreality,ENTERYOURNEWREALITY,,,,,,False
7310347946518646058,2023-12-08T17:03:53,61,US,,1500000,15000,1963,8700000,#funnyvideos #meme #catsoftiktiok #pets ,False,,internetdailypost,Internet Favorite,,,,,,False
7310051571034017070,2023-12-07T21:53:39,123,US,"Family Feud, family feud funny moment, Steve Harvey, Steve Harvey Funny Moments, Jared Padalecki Family Feud, Dumbest Family Feud Answers, family feud steve harvey, funny family feud, Harvey, Steve Harvey Show",531600,8936,2518,10200000,Answer make Steve SCARED??? #familyfeud  #familyfeudbigfan  #stevetvshow  #steveharvey  #familyfeudfunny  #fyp  #foryou,False,,familyfeudbigfan,Family Feud BigFan,,,,,,False
7306161416803716384,2023-11-27T10:17:52,116,US,,61000,396,266,753700,Wow #fyp #redditstories #storytime #foryoupage #viral #food ,False,,hihiokokf,Reddit Stories!,,,,,,False
7310729333809663264,2023-12-09T17:43:42,0,GB,,140500,22700,1662,1600000,#loveyou #relatable #her #thoughtsforher #fypシ゚viral #fypシ #onlymybabee #loveher #physicaltouch #physicaltouches #babe #redthoughts #xybca #alex473 ,False,,thoughts..for.you.69,Thoughts,,,,,,False
7309163341346295041,2023-12-05T12:26:55,14,VN,,326500,30700,1129,2500000,Trung bình 🫶🏻#fyp ,False,,meoovatho,Meovathongu,,,,,,False
7314591288395910446,2023-12-20T03:30:54,6,US,,5,0,0,311,,False,,notbelluhho,bella 🫶,,,,,,False
7300007322485542187,2023-11-10T20:16:57,8,US,"wow i like you pippi, yurick, yurick urinal, wow i like you pippi original barstool, wow i like you pippi everlong, wow i like your pea pea, i like your peep peep meme",714500,37300,3649,6100000,Bro went for it 💀 @bussinwtb (via:@Yurick) ,False,,barstoolsports,Barstool Sports,,,,,,True
7308437663994875168,2023-12-03T13:30:49,14,DE,,678800,17800,2354,3900000,hehehe 💝@🤦‍♀️  #fyp #ilovemygf #fortnite #idk #fortniteclips #fortnitememes,False,,itz_mo__,Mo,,,,,,False
7311963209630567711,2023-12-13T01:31:55,30,US,"cat distribution system, Cat Meowing, Cat Sound Attracts Cat, kittens meowing, Cat Videos, Cats Of Tiktok, Cat TikTok, Cattok, Cute Cat, Cute Cats Of TikTok",2400000,25400,13600,11400000,I think he want me to take him home....#fyp #cats ,False,,petsmeowwoof,Petsmeowwoof,,,,,,False
7308566898067770666,2023-12-03T21:52:30,5,US,"sugar cookies, Making Cookies, Making Food, cookies, Baking With Partner, Cooking Videos TikTok, Cooking Video, Cooking Food Videos, Homemade Cookies, Making Desserts",370200,15000,4626,1800000,,False,,thecerealmann,🚯,,,,,,False
7313637498410880299,2023-12-17T13:49:03,259,US,"joke swap snl, Colin Jost, snl weekend joke swap, colin jost scarlett johansson, colin jost and scarlett johansson, christmas show joke swap, weekend update snl, michael che and colin, snl, joke swap",2300000,104300,7756,20500000,christmas show joke swap 2023,False,,nbcsnl,Saturday Night Live - SNL,,,,,,True
7311489833707277601,2023-12-11T18:54:57,22,GB,,5352,89,43,47100,#stitch with @tania he got me there 🥲 #boaster #fnatic #boyfriend #girlfriend #couple #challenge ,False,,yinsucollins,Yinsu,,,,,,False
7313948410418154782,2023-12-18T09:55:28,333,US,"Jimmy Fallon Mad Libs, jimmy fallon acting game, jimmy fallon, john cena jimmy fallon, jimmy fallon fill in the word and acted out, jimmy fallon mad libs benedict cumberbatch, Benedict Cumberbatch, Jimmy Fallon Mad Libs John Cena, mad libs, benedict cumberbatch jimmy fallon",568400,1968,1084,7300000,#fyp #foryou #viral #funny ,False,,ofitiss,ofitiss,,,,,,False
7311412397523094827,2023-12-11T13:54:31,276,US,"Spider Punk, trolls animation, Spiderman Across Thespiderverse, no the robot lego movie, Spider Verse, hobie brown, animation, spiderverse animation, Across The Spider Verse, hobie spider-punk",1200000,15300,3302,8400000,"The 2nd & 3rd ways might change 3D animation forever. How many times have you watched this movie? I might be on double digits now.… Earlier this year I had a video pop off about Hobie Brown, a.k.a. Spider-Punk, and how he moves on a different frame rate than the other characters. I decided to take this and make a full video deep dive into what else spiderverse does differently. I hope Disney animation takes notes, because Wish definitely felt dated in its animation style compared to the groundbreaking techniques that Sony animation used. #spiderverse #acrossthespiderverse #spiderpunk #animation #spiderman #marvel #marveltok #animator ",False,,no_the_robot,No The Robot,,,,,,False
7308897662894460193,2023-12-04T19:15:59,16,GB,,479100,10300,2646,4200000,And that kids is how i met your mother 😭 #howimetyourmother #couple #love ,False,,reckyreckz,DOUBLER,,,,,,False
7313594024198163745,2023-12-17T11:00:11,11,DE,"ready player one, ready player one edit, bae can we turn off the lights, ready player, Relationship Memes, relatable memes, ready player one mechagodzilla, Ready Player One Club Scene, New Order Blue Monday Ready Player One, Club In Ready Player One",907800,23600,4810,5600000,#meme #relatable #fyp #readyplayerone #relationship ,False,,8ntxn,anton,,,,,,False
7314198754670759211,2023-12-19T02:06:56,23,US,"were guy girl besties, platonic friendship, boy girl bestfriends, were, were best friends of course, girl best friend, best friends guy and girl, girl and boy bsf, a guy with a girl best friend, Friends Edits",3000000,52900,7457,13800000,We’re just friends. #fyp #bestfriends #were @Cattien Le ,False,,nadeemhamidy,nadeemhamidy,,,,,,False
7314146912263802155,2023-12-18T22:45:43,8,US,"pov you have a sister who plays cod, pov you have a sister who plays videogame, pov you have a sister who plays fortnite, pov you have a brother who plays video games, Video Games, you have a brother who plays video games, pov your brother play video games, pov you have a sister who plays, Big Sister And Little Brother, Brothers",9400000,307500,95800,52200000,,False,,ben.duong,Ben Duong,,,,,,False
7309615264239291691,2023-12-06T17:40:44,0,US,"funny signs, funny signs slideshow, scary signs on roads, unsettling signs swipe, hilarious signs, signs slideshow, scary signs on roads slideshow, best signs ever, funny road signs, funny signs on roads",2800000,26600,10200,16000000,the best signs ever #hilarious #signs #cool ,False,,rand0mblackdud3,earlyman,,,,,,False
7313306622581935406,2023-12-16T16:24:59,163,US,"i don't need a license to drive p3, i dont need a drivers license to drive p4, i don't need a driver license to drive, do you need a license to drive, police officers body cam i dont need a drivers lisence, drivers license, Police Horses, cop arrests federal agent, Retired Police Cars, Cops Saving Lives",864000,6054,12800,13000000,What Law? 😂 #policeofficer #copsoftiktok ,False,,enforcedly,Enforcedly,,,,,,False
7309208704996429099,2023-12-05T15:23:08,61,US,"Perry The Platypus, why does doofenshmirtz not recognizing perry, doofenshmirtz, A Platypus Perry The Platypus, phineas and ferb, perry the platypus plumber, doofenshmirtz not recognizing perry, phineas and ferb movie, perry the platypus edit, perry and doofenshmirtz",1000000,7324,2372,5200000,Bro is so smart but cant figure out if a platypus is Perry 💀 #phineasandferb  #perrytheplatypus #fyp ,False,,cb_clan,CB Clan,,,,,,False
7308428829419261189,2023-12-03T12:56:33,0,US,"my hand your hands, hand placement, hands, mi mano tu mano, Hand Placement Couples, Things To Do With Your Hands, Hand Heart, hand placement videos, Hand Placement And Hand Posing, Slide Hand Game",630000,64300,16600,4100000,#fypシ #xyzbc #cxybca #fyp #fpyyyyyyyyy ,False,,andbrp,`,,,,,,False
7314577922004651307,2023-12-20T02:38:50,61,US,,13,0,3,213,,False,,thetruelordameno,Ameno The One True God,,,,,,False
7301357643854007595,2023-11-14T11:37:07,35,US,,836300,117900,6581,15500000,A little tour of my 2024 calendar… featuring what i believe to be the most accurate birds ever drawn! #calendar #artist #artistsoftiktok #TikTokShopBlackFriday,True,,tommysiegelcomics,Tommy Siegel Comics,,,,,,False
7307408518842305834,2023-11-30T18:57:23,62,US,,74400,465,261,530100,My new battle against British rapper Ghast Buff is out now on YT. Link in my bio,False,,andersonburrus,Anderson Burrus,,,,,,False
7299546470988959008,2023-11-09T14:28:30,88,GB,"troy barnes, Childish Gambino, troy and abed, donald glover, Troy And Abed In The Morning, troy barnes funny moments, abed core, troy barnes edit, troy sneezes like a girl, troy community",621600,5687,2053,2600000,Hes so bf.,False,,hearts4andysamberg,Manha :) (Gambino’s version),,,,,,False
7313910000882208046,2023-12-18T07:26:29,15,US,"ice play bedroom, ice, Food Hacks, ice cube, Ice Molds, Ice Roller, Ice Machine, Crushed Ice, Food Hacks On TikTok, Food Lifehacks",506800,37600,3029,4900000,#loseweight #diet #food #foodhack ,False,,seankiddauthor,Sean Kidd,,,,,,False
7314434482432396590,2023-12-19T17:21:44,6,US,,50,2,2,1123,This game activates a whole new level of panic @iSingSometimes #vtuberclips #fyp #twitch #christmas #breadandfred ,False,,monqueeeek,Monke,,,,,,False
7314360814008405291,2023-12-19T12:35:44,0,US,"Kim Chaewon, chaewon, kim chaewon edit, kim chaewon overwatch, huh yunjin, why do guys like chaewon, kim chaewon long hair, kim chaewon makeup, Communication In A Relationship, message tiktok trends",657900,6099,4038,6200000,#fyp #relationship #messages ,False,,mei.l1an,Yamin,,,,,,False
7312531368125222176,2023-12-14T14:16:30,9,DE,"damn i kinda miss him, i should call him, damn i kinda miss him white cream, i kinda miss him, damn i kinda miss her trend, damn i kinda miss him cream, I Miss Him, damn i kinda miss him white, damn i kinda miss him milk, missing someone",1100000,84800,16000,10200000,,False,,facebookmutti,lea kuehl❦,,,,,,False
7307676823154986283,2023-12-01T12:18:29,57,US,,76400,520,197,619000,Costco divorcé #standup #comedy #funny #jokes #crowdwork #standupcomedy #comedian #costco #divorce #dating ,False,,jeffarcuri,Jeff Arcuri,,,,,,False
7312114774869921066,2023-12-13T11:20:06,102,US,"standup, Stand Up Comedy, stand up performance, comedian, Stand-Up Comedian Performances, Standup Comedy Show, humor jokes, hilarious joke, real stand up guy, Stand Up Comedian Heckler",77200,922,196,501600,Meet cute #standup #comedy #funny #jokes #crowdwork #standupcomedy #comedian #meetcute #dating #fyp #jeffarcuri ,False,,jeffarcuri,Jeff Arcuri,,,,,,False
7302173915734953258,2023-11-16T16:24:31,87,US,"zach justice, indiana, zach justice funny moments, zach justice and indiana broke up, Zach Justice And Indiana, Funny Moments, zach and indiana, santa zach justice, zach justice rizz, zach justice and tara yummy",239500,1158,306,1400000,Zach Justice best moments,False,,zachjustice,Zach Justice,,,,,,True
7308798734358301985,2023-12-04T12:51:59,68,GB,"Basement Yard, do i have the floor, The Basement Yard, your turn, the basement yard funny moments, do i have the floor yes you do, backyard basement, your turn basement podcast, you should know podcast, sorry the middle of my sentence interrupted",1500000,24600,2538,8500000,“Your turn” #podcastclips #podcastclipsviral #funnypodcast #influencerpodcast #funnypodcastmoments #squidgamechallenge #thebasementyard #thebasementyardpodcastclip #thebasementyardpodcast #thebasementyardclip ,False,,thepodcastscoop,thepodcastscoop,,,,,,False
7313989912074947886,2023-12-18T12:36:30,57,US,"Comedy Stand Up, standup, stand up performance, comedian, Stand-Up Comedian Performances, Standup Comedy Show, margie the magic bus, Stand Up Comedian Heckler, Matt Rife Stand Up Comedy, Margie Marge",332200,4671,827,2400000,Margie #standup #comedy #funny #jokes #crowdwork #standupcomedy #comedian #fyp #jeffarcuri ,False,,jeffarcuri,Jeff Arcuri,,,,,,False
7313346971476151598,2023-12-16T19:01:37,7,US,"you do whatever you like, ted lasso live, you do whatever you like ted lasso, Red Flags, red flag filter, christmas, red flag costume, christmas trees, Christmas TikTok, Whatever You Like",196500,10300,829,1400000,#christmas #tattedgirls #mentalhealth #fyp #real #relatable #shortgirl #redflags ,False,,simplycozi,buh,,,,,,False
7313230196616744235,2023-12-16T11:28:30,10,US,"mall santa, mall santa girl, mall santa is creepy, meg on santa's lap, chair, You're At The Mall, Santa Running Towards Earth, Santa Running To Earth Meme, santa on party bus",262600,4774,2630,1200000,real asf // #moots? #fyp #fypage #capcut #cc #real #relatable #trending #trend #goviral #fypシ゚viral #alightmotion #am #meme #videostar #videostarpro #vs #vsp,False,,twizzzy.vsp,twizzzy.vsp,,,,,,False
7313946596993993990,2023-12-18T09:48:16,16,PK,,91800,525,1292,3000000,Le bhai hum ne b bna diya ek naye andaz mai 😂 #expandetufoto #IAutocompleta #expandetufoto ,False,,alamgirr_12,مُحمد جمال,,,,,,False
7144880346121801006,2022-09-18T20:25:01,14,US,,224,1,1,2594,#fakebody #fyp ,False,,xoxomasha_,Mash,,,,,,False
7213960468673613098,2023-03-24T00:11:05,0,US,,30,3,4,754,,False,,xoxomasha_,Mash,,,,,,False
7313956560017820959,2023-12-18T10:27:03,119,US,,760,24,10,7000,No cuz her voice sound so angelic! #kpopfypシ #kpop #kpopstan #fyp #viralvideo #yunjin #lesserafim #fearnot ,False,,belagajeilyeppeo,✝️🇨🇲👸🏾,,,,,,False
7306814683598687530,2023-11-29T04:33:59,0,US,,175600,4799,1073,1300000,im sorry matt 🗿✋🏻,False,,yingoppar,Ying♡︎,,,,,,False
7312607031096134944,2023-12-14T19:10:19,8,GB,"kung fu panda acupuncture, excuse me sir this parking is for dis, po acupuncture scene, tigress kung fu panda, excuse me sir this parking is for disabled, carparking, parking car filter, Parking For Disabled Amputated, Parallel Parking, Parking Tips",1700000,52900,5331,7900000,I aint seen no one using it #meme #fyp #fypシ ,False,,rynitzu,RynItzu,,,,,,False
7094280726245346565,2022-05-05T11:52:29,85,GB,,3375,10,2,80100,Reply to @comicscarab248 kids car won’t stop #kid #car #accident #sad #scary #police #911 #help #panic,False,,comicscarab248,memes,,,,,,False
7305921675344874782,2023-11-26T18:47:40,98,US,,4750,5,61,134900,Tony robbins police chase part 2 #movieclips #tiktokmovies #shortmovie #showclips #911onfox ,False,,lyquizrecaps,lyquizrecaps,,,,,,False
7307367250896489733,2023-11-30T16:17:06,11,ZA,,537900,1467,750,17000000,#CapCut ,False,,kaelaaofficial,Kaela,,,,,,False
7311898408304856350,2023-12-12T21:20:20,14,US,,105500,2350,214,871900,The End 🤣🤣 #funny #funnyvideos #animals #dog #cat #pet #viarl #foryou #fyp (10388),False,,dafuqboom_94,Dafuq!?Boom!,,,,,,False
7313021645101255979,2023-12-15T21:59:13,5,US,"underwater filter, pretty damn convincing filter, filters on tiktok, resort filter, pretty damn convincing, water filter effect, Checking In Pool Filters, blue filter effect, Water Lighting Filter, Water Reflection Filter",114400,203,338,5200000,I wonder how many relationships are going to end thanks to this (pretty damn convincing) TikTok filter 😂.  ##lux##luxury##luxurylife##luxuryspain##spain##luxuryresort##resort##blueskies##bluesky##pool##filter##tiktokfilter##tiktokfilterschallenge##yeahfoodbeer##fyp##fypage##foryou##foryoupage##foryourpage##goviral##viral##viralvideo##tiktokfoodie##tiktokfood #lol #laughing #funny #comedy ,False,,yeahfoodbeer,✨💥Stephanie💥✨ - NYC 🇵🇷🇨🇴,,,,,,False
7295894444086283563,2023-10-30T19:16:48,8,US,,82500,141,3652,2900000,#duet with @Drumstick #drumstick i just need to know #drumstick #drumstickfilter #drumstickcat ,False,,drumstick,Drumstick,,,,,,True
7303781647307017473,2023-11-21T00:23:07,8,NZ,,22400,269,716,915000,well... SOMETIMES not all the time #nz #Aotearoa #funny #tiktokaustralia #facts  #ohno ,False,,eddriveracomedian,Edd Rivera,,,,,,False
7296618183052594434,2023-11-01T18:05:15,15,SA,,289900,2874,0,47700000,,False,,sultansuliman03,FNF,,,,,,False
7312981788131872005,2023-12-15T19:24:19,56,ID,,26700,130,1155,4100000,,False,,pelestina587,pp kucing,,,,,,False
7308499725341216033,2023-12-03T17:31:42,5,IT,"Sitting Down Poses, my self respect leaving when he, respect, sitting opposite of standing",76200,402,89,731600,#fyp ,False,,seraahr,ser,,,,,,False
7302568662702001451,2023-11-17T17:56:21,15,US,,431000,1022,971,13100000,#stitch with @flynn thanks to the people who said try it again🫶,False,,boyflynnn,flynn,,,,,,False
7313435694506986794,2023-12-17T00:45:58,85,US,,323100,360,378,6900000,#tiktok #fyp #foryou #film #movie ,False,,bullymovie1995,Bully Movie 🎥,,,,,,False
7302779657718385951,2023-11-18T07:35:31,12,US,,560400,440,2112,16400000,,False,,karen_jones90,Karen Jones🍻,,,,,,False
7303798931312348459,2023-11-21T01:30:17,10,US,,142100,872,566,2200000,Finding templates for     you! <3 ,False,,that_bella._,Bella,,,,,,False
7307930289488071982,2023-12-02T04:42:34,16,US,,4163,124,19,22200,The girls always slay (MOD: EDEN PROJECT) #projectdiva #projectdivamegamix #projectdivamod #projectdivamodding #vocaloid #meiko #meikovocaloid #megurineluka #lukavocaloid ,False,,nullnvoiding,Null,,,,,,False
7297255591674924334,2023-11-03T11:19:04,36,US,"cat toys, Stuffed Animals, Cute Cat Toys, Cute Stuffed Animals, Cat Of Tiktok, cat videos, leaps and bounds petco rainbow caterpillar, Cat Toy Recommendations, Ball Toys For Cats, cat accessories",83500,658,375,1500000,Also the stuffed animals are just adorable haha #cattoy #cattoys ,False,,louiethelilacragdoll,Louie the Ragdoll Cat,,,,,,False
7312252136706903339,2023-12-13T20:13:09,16,US,"Laptop In A Car, Car In The Kitchen",53000,326,2500,3100000,,False,,geeks_and_roses,user2443378086756,,,,,,False
7291746342186142981,2023-10-19T14:59:58,10,CL,,1300000,12000,6678,9100000,Hola adivinen quien va a estar de cumpleaños (lino) #shuporangporanglinos #dospuntosv ,False,,felixista_proalv,la mejor felixista😍‼️,,,,,,False
7313806982035672363,2023-12-18T00:46:55,0,US,,368,0,10,6670,#xh #fyp #viet ,False,,bovivi_,ViiBP,,,,,,False
7312460252077755690,2023-12-14T09:40:42,7,US,"why are you single, bro why are you single, Griffrule, the griff rule, Birds Singing, birds, reasons why i'm single, why am i single trend, reasons im single according to my bsf, griff rule explained",812900,12900,5441,4600000,#griffrule #fyp ,False,,aidxnaye,McQueen,,,,,,False
7307780092678229291,2023-12-01T18:59:17,12,US,,81300,96,262,3100000,Tag me if u beat it (I bet u can’t) #gamefilter #filter #tomandjerrytraps #tiktokgame #fyp ,False,,prodbyppurplesauce,ppurplesauce,,,,,,False
7311193527650667782,2023-12-10T23:44:59,13,ID,"hey i miss you filter, i miss you filter, I Miss Him",580500,1130,719,5300000,mem-,False,,meiiyesklgabut,siapa hayo,,,,,,False
7310347818663759134,2023-12-08T17:03:27,7,US,"boy math, toxic traits filter, boy math logic, harness your hopes, math, Here's A Toxic Trait That I Have, toxic traits, Now Here's A Toxic Trait That I Have, Guess The Filter, girl math logic",122700,101,323,2400000,ngl ,False,,ariyaamonet,ariya,,,,,,False
7306229978310462752,2023-11-27T14:43:54,5,IT,,228600,1737,480,1300000,#fyp ,False,,seraahr,ser,,,,,,False
7307377980001553666,2023-11-30T16:58:50,49,AU,,18000,64,505,2700000,Lol good job 👏,False,,shanivennni,Shani,,,,,,False
7312570082679442731,2023-12-14T16:46:54,0,US,,66700,441,540,731700,,False,,prominentreads,prominentreads,,,,,,False
7311429882536348971,2023-12-11T15:02:24,13,US,"christmas games, christmas, grinch, McDonald’s, christmas dinner ideas, Ai Filter, christmas desserts, Christmas Cookies, family christmas games, the grinch",144700,1039,2518,8000000,Christmas is here. #fyp #christmas #itsthemostwonderfultimeoftheyear #dangglesdidit #mcdonalds ,False,,dangglesdid.it,Danggles DID”it,,,,,,False
7312924991085890862,2023-12-15T15:43:59,5,US,"Lego Fortnite, Fortnite, Pookie, pookie costume, fortnite clips, Play Fortnite With Me, Fortnite Funny Videos, im not playing fortnite, Let's Play Fortnite, duo for life",2000000,51700,15600,12200000,should’ve got online #fyp #foryou #relatable ,False,,anthonypert,Anthony,,,,,,False
7298728074353315105,2023-11-07T09:32:41,83,US,,157400,155,155,3500000,Part 1 #storytime #fyp #foryoupage #viral ,False,,redditnta37,redditnta37,,,,,,False
7306841113808129282,2023-11-29T06:15:26,10,AU,"chris evans, message from 30 year old you, chris evans radio host, chris evans dj radio, message from my 30 year old self, chris evans edits, message from 30 year old you filter, message from your 30 year old self filter, Chris Evans American Actor, message from",1200000,847,2350,18300000,Go stream my song so i can have a fling with Chris Evans,False,,jjesshumphries,Jess,,,,,,False
7291793626089245982,2023-10-19T18:03:33,8,US,,419900,44300,1255,4400000,#stitch with @Campbell  it did me so dirty #Asian #asianstereotype #asianeyes ,False,,yaksa.cosplay,Yaksa,,,,,,False
7304850953054866731,2023-11-23T21:32:40,7,US,,21100,31,41,377700,Did you like the story?#story #storytime #foryou ,False,,lomanhub,Arthur Pen,,,,,,False
7309634904910826794,2023-12-06T18:56:53,0,US,,52300,861,525,334500,Thank god I’m not a shark! Gotta go to Miniso every week! 🥰 #meme #fyp #relatable #funny #foryou #minisousa #sharks #sadfactsaboutsharks #sharkmeme #blindbox #blindboxes #blindboxtoys,False,,minisounitedstates,MINISO United States,,,,,,True
7285994508431559937,2023-10-04T02:59:57,13,NP,,3600000,26500,12300,51900000,#CapCut #hutraj#makhanstore ,False,,hutrajshrestha,Hutraj Shrestha,,,,,,False
7308944137175272709,2023-12-04T22:16:11,0,CA,,233500,4201,3687,1600000,Ruins the whole mood #Fyp #pakistanifood #biryani #sadmoment @🤎 ,False,,itsyanoduh,ItsYano😼,,,,,,False
7308417812496682272,2023-12-03T12:13:49,109,GB,,73800,36,343,1500000,#film #fyp #movie #fypシ ,False,,lwn19869zw8,Autumn wind,,,,,,False
7306628349017869601,2023-11-28T16:29:47,6,IT,,68200,102,62,694200,#fyp ,False,,seraahr,ser,,,,,,False
